activity_id,campaign_id,person_id,activity_type,timestamp,detail
1,1.0,3232.0,email_open,01-08-2024 12:54,Firefox
2,13.0,4953.0,,2024-01-25 12:15:00,tracking lost
3,9.0,4210.0,email_click,10/01/2024 13:55,unknown
4,4.0,4230.0,web-visit,01-18-2024 16:09,
5,7.0,4655.0,,01-10-2024 08:27,
6,15.0,3032.0,Email Open,2024-01-14 02:50:00,
7,10.0,2199.0,email_click,01-22-2024 07:16,utm=xyz
8,6.0,2365.0,web_visit,2024-01-27 12:40:00,
9,14.0,1281.0,web_visit,2024-01-08 01:16:00,tracking lost
10,7.0,3054.0,,2024-01-10 17:15:00,
11,6.0,2504.0,web-visit,30/01/2024 20:56,
12,4.0,2882.0,email_open,08/01/2024 11:50,Firefox
13,2.0,1404.0,EMAIL_CLICK,01-25-2024 13:09,tracking lost
14,2.0,3501.0,FORMFILL,01-20-2024 16:23,Firefox
15,9.0,3534.0,EMAIL_CLICK,2024-01-30 13:40:00,unknown
16,15.0,4927.0,email_open,27/01/2024 17:45,unknown
17,15.0,3220.0,,23/01/2024 03:49,Firefox
18,10.0,3647.0,email_click,2024-01-24 18:26:00,
19,1.0,2200.0,FORMFILL,21/01/2024 13:44,tracking lost
20,5.0,2871.0,FORMFILL,11/01/2024 15:10,
21,12.0,4493.0,,2024-01-24 21:00:00,
22,8.0,4984.0,web_visit,15/01/2024 17:05,unknown
23,5.0,4297.0,FORMFILL,01-01-2024 02:18,
24,15.0,1268.0,web-visit,01-15-2024 14:02,utm=xyz
25,4.0,1693.0,web-visit,15/01/2024 22:26,unknown
26,3.0,4748.0,EMAIL_CLICK,2024-01-16 01:14:00,
27,12.0,2027.0,email_click,01-03-2024 11:37,Browser: Chrome
28,3.0,4703.0,email_open,01-07-2024 08:04,Firefox
29,12.0,1660.0,FORMFILL,10/01/2024 18:38,
30,5.0,4139.0,Email Open,16/01/2024 20:40,unknown
31,7.0,4070.0,,2024-01-02 00:01:00,unknown
32,7.0,3865.0,EMAIL_CLICK,06/01/2024 19:02,unknown
33,6.0,4865.0,web-visit,25/01/2024 01:42,Firefox
34,8.0,2059.0,,13/01/2024 17:35,
35,10.0,1658.0,email_open,25/01/2024 14:52,Browser: Chrome
36,10.0,3745.0,form_fill,2024-01-01 19:11:00,Firefox
37,4.0,1102.0,web-visit,21/01/2024 06:24,utm=xyz
38,10.0,3408.0,Email Open,2024-01-30 05:45:00,tracking lost
39,15.0,2211.0,email_click,14/01/2024 14:47,
40,6.0,3444.0,EMAIL_CLICK,2024-01-20 17:18:00,tracking lost
41,14.0,4001.0,EMAIL_CLICK,08/01/2024 00:43,Firefox
42,5.0,3317.0,web-visit,2024-01-26 21:51:00,
43,11.0,2458.0,web_visit,2024-01-11 11:03:00,Firefox
44,10.0,1978.0,FORMFILL,01-07-2024 21:32,
45,3.0,3829.0,web_visit,05/01/2024 20:03,
46,11.0,3216.0,form_fill,07/01/2024 20:45,Browser: Chrome
47,4.0,1814.0,FORMFILL,20/01/2024 23:30,
48,1.0,4001.0,Email Open,01-05-2024 01:45,
49,8.0,3078.0,EMAIL_CLICK,01-07-2024 05:40,
50,7.0,3188.0,form_fill,06/01/2024 10:35,unknown
51,15.0,1801.0,email_click,30/01/2024 07:21,
52,15.0,2210.0,,19/01/2024 22:21,unknown
53,8.0,3197.0,email_open,2024-01-01 08:55:00,Firefox
54,6.0,1351.0,web_visit,01-10-2024 17:24,
55,2.0,4831.0,email_click,23/01/2024 06:46,utm=xyz
56,3.0,3951.0,Email Open,29/01/2024 17:30,Firefox
57,15.0,2110.0,FORMFILL,2024-01-26 22:38:00,
58,3.0,2942.0,EMAIL_CLICK,2024-01-02 18:43:00,
59,9.0,3493.0,email_click,01-21-2024 09:49,
60,13.0,3389.0,Email Open,01-07-2024 16:18,Firefox
61,12.0,2139.0,,2024-01-30 13:23:00,
62,15.0,1990.0,email_click,01-06-2024 23:45,
63,5.0,2156.0,web-visit,2024-01-03 00:57:00,
64,13.0,4091.0,form_fill,2024-01-14 10:34:00,utm=xyz
65,13.0,3717.0,Email Open,12/01/2024 04:57,
66,6.0,1572.0,email_open,01-16-2024 05:34,unknown
67,3.0,3333.0,web-visit,22/01/2024 18:06,
68,8.0,2460.0,EMAIL_CLICK,2024-01-22 09:00:00,
69,5.0,4160.0,,01-05-2024 15:16,
70,13.0,3879.0,web-visit,01-09-2024 07:08,
71,13.0,3679.0,form_fill,06/01/2024 12:25,
72,7.0,1814.0,EMAIL_CLICK,01-23-2024 23:14,
73,7.0,2566.0,web-visit,01-30-2024 20:27,utm=xyz
74,11.0,3012.0,form_fill,22/01/2024 14:06,unknown
75,9.0,3649.0,web-visit,26/01/2024 18:41,unknown
76,11.0,4943.0,Email Open,2024-01-28 14:47:00,Firefox
77,10.0,3010.0,form_fill,01/01/2024 08:54,Browser: Chrome
78,2.0,3897.0,web-visit,13/01/2024 15:33,utm=xyz
79,12.0,2877.0,EMAIL_CLICK,2024-01-06 21:27:00,tracking lost
80,10.0,2766.0,FORMFILL,01-16-2024 00:30,
81,15.0,2678.0,web_visit,2024-01-20 05:32:00,
82,12.0,2151.0,web_visit,01-04-2024 23:38,
83,7.0,3768.0,FORMFILL,2024-01-29 14:55:00,tracking lost
84,2.0,1679.0,form_fill,01-10-2024 06:16,Firefox
85,2.0,1280.0,Email Open,08/01/2024 17:36,unknown
86,15.0,4603.0,form_fill,09/01/2024 20:52,
87,1.0,3475.0,web-visit,01-06-2024 20:27,tracking lost
88,1.0,3732.0,web-visit,2024-01-14 03:57:00,tracking lost
89,14.0,2219.0,EMAIL_CLICK,2024-01-19 07:10:00,
90,3.0,2820.0,,2024-01-30 07:42:00,
91,9.0,3446.0,FORMFILL,01-28-2024 03:50,Browser: Chrome
92,11.0,2648.0,FORMFILL,01-03-2024 01:59,Firefox
93,10.0,2252.0,form_fill,30/01/2024 05:38,Browser: Chrome
94,1.0,4002.0,email_click,01-12-2024 01:04,Firefox
95,7.0,1961.0,EMAIL_CLICK,2024-01-02 16:37:00,utm=xyz
96,3.0,4892.0,web-visit,10/01/2024 23:39,
97,9.0,3087.0,,01-22-2024 12:29,
98,6.0,2472.0,form_fill,01-18-2024 16:03,tracking lost
99,12.0,3835.0,web_visit,13/01/2024 09:14,Firefox
100,12.0,2518.0,web-visit,27/01/2024 21:48,utm=xyz
101,1.0,2870.0,,13/01/2024 11:55,
102,11.0,4223.0,FORMFILL,04/01/2024 06:45,Firefox
103,4.0,3230.0,,02/01/2024 18:40,
104,9.0,1785.0,EMAIL_CLICK,01-24-2024 09:30,Browser: Chrome
105,8.0,4477.0,EMAIL_CLICK,01-10-2024 16:58,
106,4.0,2256.0,form_fill,05/01/2024 01:45,unknown
107,11.0,1258.0,web-visit,25/01/2024 18:15,
108,6.0,3942.0,email_click,08/01/2024 08:37,
109,5.0,4750.0,Email Open,01-24-2024 05:18,
110,11.0,4674.0,web_visit,2024-01-02 02:37:00,unknown
111,4.0,2057.0,EMAIL_CLICK,03/01/2024 10:08,
112,10.0,1916.0,form_fill,18/01/2024 12:25,
113,4.0,4415.0,email_open,2024-01-17 03:48:00,Browser: Chrome
114,3.0,3316.0,EMAIL_CLICK,29/01/2024 13:30,
115,15.0,4470.0,form_fill,2024-01-03 22:20:00,
116,12.0,2808.0,form_fill,2024-01-25 14:17:00,
117,7.0,3926.0,Email Open,01-15-2024 03:29,
118,11.0,4851.0,Email Open,01-21-2024 21:36,
119,12.0,1757.0,Email Open,2024-01-08 07:49:00,Firefox
120,3.0,3761.0,,24/01/2024 08:01,
121,3.0,4302.0,email_open,01-11-2024 01:13,unknown
122,3.0,1268.0,FORMFILL,2024-01-09 11:33:00,utm=xyz
123,7.0,2404.0,email_click,07/01/2024 13:13,
124,6.0,4519.0,email_click,01-11-2024 17:16,
125,13.0,1083.0,EMAIL_CLICK,01-04-2024 16:46,Firefox
126,12.0,2455.0,FORMFILL,14/01/2024 13:28,
127,5.0,1083.0,,01-30-2024 13:53,tracking lost
128,11.0,2817.0,form_fill,2024-01-15 21:14:00,
129,9.0,1711.0,email_click,26/01/2024 15:07,Firefox
130,7.0,4462.0,form_fill,30/01/2024 13:21,utm=xyz
131,7.0,1110.0,email_open,2024-01-11 18:13:00,
132,9.0,4869.0,web_visit,24/01/2024 21:56,utm=xyz
133,11.0,1432.0,form_fill,16/01/2024 11:57,Firefox
134,8.0,2235.0,email_open,2024-01-27 09:13:00,utm=xyz
135,5.0,2314.0,form_fill,2024-01-24 04:51:00,
136,2.0,1132.0,,21/01/2024 05:01,
137,5.0,1169.0,EMAIL_CLICK,2024-01-26 13:25:00,Browser: Chrome
138,14.0,1833.0,web_visit,2024-01-16 21:18:00,unknown
139,8.0,4899.0,EMAIL_CLICK,2024-01-29 15:58:00,Browser: Chrome
140,1.0,1242.0,FORMFILL,01-08-2024 21:49,
141,6.0,1470.0,FORMFILL,01-06-2024 06:56,Firefox
142,2.0,1585.0,web_visit,01-29-2024 08:31,
143,2.0,3473.0,web_visit,01-08-2024 22:38,
144,10.0,2219.0,Email Open,24/01/2024 09:06,tracking lost
145,4.0,1301.0,web-visit,27/01/2024 21:38,unknown
146,11.0,2455.0,web-visit,01-25-2024 12:49,tracking lost
147,3.0,4748.0,form_fill,20/01/2024 15:08,
148,10.0,4757.0,form_fill,01-07-2024 17:46,
149,5.0,3092.0,email_open,01-27-2024 13:26,
150,10.0,1344.0,email_click,2024-01-26 12:13:00,utm=xyz
151,9.0,1295.0,Email Open,01-26-2024 06:24,unknown
152,10.0,4391.0,web_visit,01-13-2024 20:13,Firefox
153,8.0,4673.0,email_open,23/01/2024 01:12,
154,2.0,3310.0,web_visit,26/01/2024 04:32,
155,2.0,2048.0,web-visit,01-30-2024 00:52,tracking lost
156,8.0,2589.0,web_visit,2024-01-26 02:56:00,unknown
157,8.0,4195.0,Email Open,19/01/2024 08:34,
158,15.0,1520.0,,30/01/2024 12:44,
159,9.0,4046.0,EMAIL_CLICK,23/01/2024 14:18,tracking lost
160,8.0,1260.0,EMAIL_CLICK,2024-01-22 06:45:00,
161,12.0,4702.0,FORMFILL,01-06-2024 19:32,
162,5.0,3975.0,Email Open,01-28-2024 01:28,
163,6.0,3526.0,Email Open,26/01/2024 09:59,
164,6.0,4327.0,email_click,2024-01-26 19:52:00,
165,12.0,1083.0,Email Open,01-01-2024 03:10,tracking lost
166,4.0,4112.0,email_open,01-08-2024 18:48,
167,13.0,1442.0,form_fill,08/01/2024 23:11,
168,3.0,4605.0,EMAIL_CLICK,24/01/2024 22:28,
169,11.0,2160.0,,2024-01-02 11:45:00,tracking lost
170,1.0,2534.0,Email Open,01-21-2024 03:26,Firefox
171,4.0,3504.0,,01-23-2024 16:09,
172,10.0,4081.0,web-visit,01-01-2024 11:54,
173,7.0,3210.0,Email Open,01-09-2024 00:21,
174,2.0,1002.0,web_visit,01-04-2024 08:43,Browser: Chrome
175,6.0,1015.0,email_click,2024-01-09 09:20:00,
176,8.0,1412.0,email_open,27/01/2024 00:14,
177,3.0,4636.0,FORMFILL,19/01/2024 16:29,
178,9.0,1796.0,web-visit,05/01/2024 23:56,
179,3.0,2116.0,EMAIL_CLICK,01-18-2024 09:50,
180,3.0,1962.0,email_click,01-16-2024 13:26,utm=xyz
181,3.0,4593.0,Email Open,2024-01-25 03:40:00,
182,6.0,2725.0,email_open,2024-01-17 15:57:00,tracking lost
183,5.0,2870.0,,16/01/2024 13:00,unknown
184,1.0,3105.0,web_visit,01-21-2024 18:01,
185,9.0,1253.0,Email Open,01-03-2024 22:15,
186,6.0,3487.0,,2024-01-13 03:30:00,unknown
187,10.0,1409.0,EMAIL_CLICK,2024-01-14 03:15:00,
188,11.0,4328.0,form_fill,11/01/2024 11:29,tracking lost
189,13.0,2533.0,web_visit,2024-01-08 21:08:00,Firefox
190,7.0,4712.0,EMAIL_CLICK,2024-01-16 22:46:00,
191,1.0,4026.0,FORMFILL,26/01/2024 01:10,
192,11.0,3167.0,web_visit,2024-01-18 01:35:00,utm=xyz
193,1.0,2870.0,,01-17-2024 17:40,Browser: Chrome
194,4.0,1451.0,Email Open,04/01/2024 13:06,
195,6.0,2821.0,web_visit,01-16-2024 20:01,
196,7.0,1615.0,web-visit,01-15-2024 14:11,Browser: Chrome
197,12.0,2558.0,Email Open,08/01/2024 09:45,
198,5.0,3563.0,form_fill,01-04-2024 22:56,unknown
199,8.0,3603.0,Email Open,2024-01-14 14:31:00,tracking lost
200,3.0,2453.0,web_visit,2024-01-10 12:24:00,
201,1.0,4289.0,,2024-01-21 09:55:00,utm=xyz
202,15.0,1558.0,email_open,12/01/2024 12:05,
203,13.0,2477.0,email_open,01-30-2024 05:15,Firefox
204,13.0,2512.0,EMAIL_CLICK,29/01/2024 13:00,Firefox
205,15.0,3348.0,EMAIL_CLICK,15/01/2024 07:38,Browser: Chrome
206,4.0,4984.0,web_visit,2024-01-30 18:24:00,Firefox
207,5.0,2395.0,email_open,2024-01-29 17:00:00,
208,7.0,3352.0,FORMFILL,2024-01-21 15:55:00,
209,15.0,1875.0,Email Open,01-27-2024 07:05,
210,7.0,1139.0,web-visit,2024-01-13 05:19:00,Firefox
211,5.0,4435.0,,01-06-2024 06:20,utm=xyz
212,7.0,4075.0,,2024-01-20 01:24:00,
213,9.0,1904.0,email_click,30/01/2024 03:18,
214,15.0,1974.0,form_fill,01-07-2024 07:39,unknown
215,5.0,1372.0,FORMFILL,01-06-2024 14:25,
216,2.0,4029.0,form_fill,23/01/2024 04:49,Browser: Chrome
217,9.0,4805.0,email_click,02/01/2024 14:41,utm=xyz
218,7.0,4301.0,,23/01/2024 00:28,tracking lost
219,13.0,2753.0,email_click,03/01/2024 21:00,
220,4.0,3520.0,EMAIL_CLICK,2024-01-11 14:00:00,
221,3.0,1680.0,EMAIL_CLICK,2024-01-15 02:23:00,
222,6.0,2174.0,Email Open,01/01/2024 04:15,
223,14.0,2737.0,email_open,27/01/2024 00:41,tracking lost
224,10.0,4363.0,web-visit,2024-01-06 23:37:00,
225,6.0,1193.0,web-visit,01-17-2024 03:24,
226,8.0,2554.0,,13/01/2024 08:22,tracking lost
227,12.0,3056.0,EMAIL_CLICK,2024-01-12 15:01:00,Firefox
228,14.0,2382.0,form_fill,01-18-2024 04:00,
229,14.0,1157.0,EMAIL_CLICK,01-18-2024 11:07,
230,10.0,3133.0,form_fill,2024-01-16 13:08:00,Firefox
231,9.0,3876.0,web-visit,2024-01-28 22:32:00,tracking lost
232,6.0,1470.0,email_click,2024-01-28 10:47:00,utm=xyz
233,5.0,4764.0,email_click,22/01/2024 16:40,
234,13.0,3456.0,form_fill,2024-01-20 19:14:00,utm=xyz
235,11.0,3692.0,email_open,2024-01-30 10:02:00,utm=xyz
236,2.0,1003.0,FORMFILL,2024-01-01 17:44:00,Firefox
237,8.0,2390.0,email_click,05/01/2024 03:41,
238,13.0,3396.0,email_open,01-29-2024 10:30,Browser: Chrome
239,9.0,3235.0,email_open,01-07-2024 20:19,utm=xyz
240,13.0,3265.0,email_open,2024-01-25 14:30:00,
241,14.0,2200.0,Email Open,2024-01-15 01:10:00,tracking lost
242,9.0,4721.0,form_fill,2024-01-24 00:19:00,Firefox
243,3.0,1202.0,email_open,2024-01-30 23:28:00,tracking lost
244,13.0,2598.0,form_fill,30/01/2024 21:20,
245,15.0,1459.0,,01-12-2024 15:14,
246,12.0,2848.0,,01-02-2024 04:44,Firefox
247,11.0,2240.0,,01-21-2024 07:14,
248,6.0,3420.0,form_fill,01-10-2024 08:57,unknown
249,5.0,2267.0,web_visit,10/01/2024 14:22,utm=xyz
250,11.0,4987.0,,01-23-2024 01:32,
251,1.0,4538.0,web-visit,01-18-2024 10:33,
252,2.0,4542.0,web-visit,12/01/2024 18:16,
253,10.0,2501.0,form_fill,01-25-2024 13:10,tracking lost
254,10.0,2336.0,EMAIL_CLICK,2024-01-06 20:50:00,Firefox
255,1.0,2461.0,FORMFILL,01-12-2024 13:45,Firefox
256,8.0,2267.0,Email Open,01-22-2024 02:43,Browser: Chrome
257,13.0,3211.0,form_fill,30/01/2024 13:31,tracking lost
258,12.0,2095.0,Email Open,29/01/2024 09:19,utm=xyz
259,8.0,3994.0,FORMFILL,30/01/2024 09:28,
260,9.0,3411.0,Email Open,05/01/2024 11:22,
261,3.0,2420.0,FORMFILL,2024-01-07 03:22:00,tracking lost
262,11.0,4995.0,EMAIL_CLICK,2024-01-06 11:46:00,Firefox
263,4.0,4587.0,Email Open,01-22-2024 19:15,
264,4.0,4480.0,web_visit,01-25-2024 17:49,Browser: Chrome
265,4.0,4954.0,email_open,01-27-2024 03:47,
266,6.0,3251.0,web-visit,30/01/2024 12:17,
267,14.0,1120.0,,25/01/2024 20:19,Browser: Chrome
268,14.0,4684.0,web_visit,11/01/2024 21:12,tracking lost
269,11.0,4676.0,email_open,2024-01-19 14:25:00,
270,6.0,1612.0,,2024-01-28 06:29:00,utm=xyz
271,4.0,2854.0,form_fill,01-21-2024 09:28,Browser: Chrome
272,7.0,2740.0,form_fill,20/01/2024 09:45,utm=xyz
273,13.0,2543.0,form_fill,01-10-2024 18:16,
274,10.0,4016.0,form_fill,12/01/2024 23:38,
275,5.0,4274.0,FORMFILL,03/01/2024 11:06,
276,12.0,3399.0,EMAIL_CLICK,2024-01-29 21:59:00,unknown
277,4.0,4286.0,Email Open,01-25-2024 06:26,
278,5.0,2877.0,email_open,01-18-2024 23:36,
279,15.0,2330.0,web_visit,01-06-2024 13:29,unknown
280,9.0,4565.0,email_open,01-16-2024 14:33,tracking lost
281,1.0,1695.0,form_fill,01-26-2024 10:26,
282,2.0,1809.0,web_visit,01-03-2024 13:09,Browser: Chrome
283,5.0,3695.0,web_visit,2024-01-08 22:58:00,Browser: Chrome
284,9.0,4132.0,form_fill,2024-01-23 09:30:00,
285,9.0,4069.0,Email Open,2024-01-21 10:25:00,
286,9.0,2338.0,FORMFILL,2024-01-15 12:57:00,utm=xyz
287,13.0,4090.0,EMAIL_CLICK,29/01/2024 05:40,
288,4.0,2611.0,web-visit,2024-01-24 00:56:00,utm=xyz
289,7.0,4080.0,email_open,01-10-2024 23:36,tracking lost
290,8.0,4392.0,email_open,19/01/2024 21:43,
291,8.0,3691.0,web-visit,01-18-2024 06:43,unknown
292,8.0,2721.0,email_click,03/01/2024 16:23,utm=xyz
293,9.0,3514.0,web_visit,12/01/2024 22:13,
294,9.0,2831.0,EMAIL_CLICK,01-25-2024 01:21,Browser: Chrome
295,11.0,3533.0,email_open,2024-01-18 14:44:00,Firefox
296,1.0,2231.0,email_click,01-13-2024 06:12,unknown
297,13.0,1468.0,FORMFILL,01-24-2024 02:38,Firefox
298,5.0,1051.0,web-visit,01-16-2024 17:39,
299,5.0,3386.0,FORMFILL,25/01/2024 05:53,utm=xyz
300,4.0,3181.0,form_fill,2024-01-24 23:58:00,
301,12.0,2032.0,email_click,01-05-2024 08:27,
302,14.0,4022.0,email_open,2024-01-22 02:41:00,unknown
303,10.0,4946.0,form_fill,21/01/2024 22:00,Firefox
304,2.0,3172.0,EMAIL_CLICK,2024-01-07 07:41:00,tracking lost
305,12.0,2076.0,email_click,01-08-2024 02:24,
306,1.0,3155.0,web_visit,01-01-2024 06:52,
307,12.0,2353.0,email_click,2024-01-12 19:22:00,
308,15.0,3807.0,Email Open,01-28-2024 18:59,
309,14.0,3830.0,FORMFILL,12/01/2024 21:00,
310,8.0,1952.0,FORMFILL,01-25-2024 00:58,
311,8.0,1906.0,email_click,2024-01-18 11:36:00,utm=xyz
312,9.0,1463.0,web_visit,15/01/2024 07:01,utm=xyz
313,5.0,3873.0,email_open,2024-01-28 19:12:00,Firefox
314,10.0,2318.0,Email Open,10/01/2024 02:09,unknown
315,13.0,2367.0,web_visit,25/01/2024 08:19,
316,6.0,2208.0,EMAIL_CLICK,01-20-2024 13:13,Firefox
317,12.0,1500.0,form_fill,01-13-2024 18:41,tracking lost
318,9.0,3989.0,form_fill,01-20-2024 16:59,unknown
319,9.0,4793.0,Email Open,01-01-2024 01:47,tracking lost
320,10.0,3940.0,email_open,01-22-2024 12:41,Firefox
321,15.0,3663.0,form_fill,02/01/2024 22:41,utm=xyz
322,2.0,4085.0,Email Open,2024-01-08 22:05:00,utm=xyz
323,3.0,3818.0,FORMFILL,01/01/2024 11:12,
324,6.0,4913.0,email_open,01-28-2024 17:14,
325,11.0,4769.0,Email Open,2024-01-14 22:11:00,Browser: Chrome
326,8.0,4583.0,FORMFILL,2024-01-24 13:19:00,unknown
327,10.0,3669.0,FORMFILL,03/01/2024 03:45,Firefox
328,1.0,3872.0,web-visit,01-12-2024 09:45,tracking lost
329,9.0,2592.0,web_visit,29/01/2024 12:47,utm=xyz
330,9.0,1438.0,email_open,01-11-2024 03:55,
331,5.0,1243.0,web_visit,2024-01-10 14:20:00,
332,4.0,2979.0,FORMFILL,2024-01-30 04:25:00,unknown
333,9.0,1251.0,email_click,2024-01-28 21:39:00,Browser: Chrome
334,14.0,3133.0,email_open,2024-01-18 01:05:00,utm=xyz
335,5.0,4470.0,EMAIL_CLICK,2024-01-21 04:34:00,Firefox
336,13.0,4142.0,web_visit,01-21-2024 11:17,unknown
337,10.0,3715.0,web-visit,01-12-2024 01:58,Browser: Chrome
338,2.0,1275.0,form_fill,01-24-2024 11:56,
339,3.0,4437.0,FORMFILL,05/01/2024 00:26,
340,14.0,2287.0,email_click,17/01/2024 02:28,
341,13.0,4783.0,web_visit,2024-01-20 17:02:00,
342,3.0,4389.0,email_click,01-19-2024 19:42,unknown
343,9.0,1451.0,web-visit,01/01/2024 00:14,
344,15.0,2859.0,form_fill,21/01/2024 05:29,Firefox
345,3.0,3499.0,form_fill,23/01/2024 03:26,
346,3.0,4270.0,web-visit,2024-01-05 23:05:00,utm=xyz
347,12.0,4458.0,web_visit,03/01/2024 18:41,
348,12.0,1238.0,FORMFILL,2024-01-08 17:02:00,Firefox
349,5.0,1546.0,web_visit,01-06-2024 19:54,unknown
350,7.0,4473.0,web_visit,23/01/2024 18:45,
351,7.0,4845.0,email_click,2024-01-03 11:19:00,tracking lost
352,8.0,3949.0,Email Open,2024-01-28 02:59:00,utm=xyz
353,3.0,3819.0,email_click,16/01/2024 20:57,
354,4.0,1578.0,EMAIL_CLICK,01-07-2024 10:55,
355,4.0,2655.0,FORMFILL,2024-01-28 00:01:00,tracking lost
356,2.0,2118.0,EMAIL_CLICK,2024-01-16 10:18:00,tracking lost
357,15.0,3888.0,FORMFILL,2024-01-22 02:27:00,
358,15.0,3550.0,email_open,12/01/2024 18:03,
359,3.0,2509.0,,2024-01-23 07:45:00,
360,10.0,4172.0,web-visit,01-15-2024 14:34,tracking lost
361,12.0,4512.0,email_click,01-02-2024 03:58,
362,4.0,3684.0,EMAIL_CLICK,2024-01-26 03:28:00,
363,7.0,2415.0,form_fill,2024-01-09 08:11:00,utm=xyz
364,2.0,4684.0,email_click,30/01/2024 12:58,tracking lost
365,15.0,1098.0,form_fill,01-29-2024 12:42,
366,3.0,4769.0,web-visit,01-02-2024 06:16,Browser: Chrome
367,8.0,2228.0,Email Open,13/01/2024 09:59,tracking lost
368,14.0,3673.0,EMAIL_CLICK,28/01/2024 14:59,
369,13.0,3131.0,email_open,27/01/2024 20:41,utm=xyz
370,10.0,1645.0,FORMFILL,23/01/2024 00:13,
371,11.0,2924.0,email_open,2024-01-03 14:51:00,
372,9.0,2358.0,EMAIL_CLICK,2024-01-13 11:48:00,
373,4.0,1099.0,Email Open,15/01/2024 04:13,tracking lost
374,13.0,4340.0,EMAIL_CLICK,09/01/2024 08:34,Browser: Chrome
375,11.0,3369.0,Email Open,01-21-2024 18:02,
376,4.0,4358.0,EMAIL_CLICK,01-05-2024 12:30,tracking lost
377,9.0,4206.0,Email Open,01-01-2024 23:14,
378,1.0,1439.0,Email Open,26/01/2024 04:17,
379,6.0,3024.0,web-visit,2024-01-22 00:13:00,unknown
380,13.0,1621.0,web_visit,2024-01-22 14:37:00,utm=xyz
381,4.0,3219.0,,2024-01-01 12:06:00,
382,8.0,2446.0,EMAIL_CLICK,2024-01-04 11:46:00,unknown
383,3.0,2803.0,EMAIL_CLICK,09/01/2024 11:57,
384,14.0,4102.0,email_click,2024-01-11 20:47:00,Firefox
385,2.0,2877.0,web_visit,06/01/2024 02:11,unknown
386,3.0,2457.0,web-visit,2024-01-22 00:16:00,utm=xyz
387,4.0,1213.0,EMAIL_CLICK,01-08-2024 22:53,
388,13.0,2820.0,,2024-01-01 05:58:00,Browser: Chrome
389,6.0,4043.0,FORMFILL,2024-01-01 16:29:00,Browser: Chrome
390,3.0,4439.0,,06/01/2024 13:28,
391,6.0,1392.0,form_fill,01-30-2024 19:26,tracking lost
392,14.0,2575.0,email_open,01-17-2024 04:55,
393,7.0,2941.0,web_visit,03/01/2024 20:08,unknown
394,5.0,1109.0,Email Open,2024-01-12 06:29:00,
395,11.0,2140.0,email_open,29/01/2024 10:12,
396,10.0,1127.0,FORMFILL,01-11-2024 04:51,tracking lost
397,4.0,1049.0,web_visit,01-10-2024 02:04,utm=xyz
398,8.0,2895.0,FORMFILL,01-17-2024 07:19,Browser: Chrome
399,2.0,4865.0,web-visit,2024-01-06 16:07:00,utm=xyz
400,14.0,3902.0,web_visit,01-01-2024 09:57,Browser: Chrome
401,6.0,1434.0,FORMFILL,24/01/2024 05:40,
402,9.0,2880.0,email_click,2024-01-10 08:20:00,
403,14.0,1095.0,email_open,28/01/2024 06:16,unknown
404,14.0,2421.0,Email Open,2024-01-20 11:16:00,
405,6.0,3102.0,Email Open,01-20-2024 05:39,Browser: Chrome
406,14.0,4662.0,form_fill,01-29-2024 08:49,Browser: Chrome
407,12.0,2030.0,email_open,15/01/2024 20:24,Browser: Chrome
408,13.0,2681.0,FORMFILL,01-26-2024 22:23,Browser: Chrome
409,15.0,1528.0,email_click,01/01/2024 16:58,
410,5.0,4056.0,web_visit,2024-01-13 22:39:00,
411,4.0,4100.0,,04/01/2024 22:40,
412,13.0,1782.0,web_visit,2024-01-21 03:04:00,tracking lost
413,9.0,4683.0,web-visit,2024-01-27 09:27:00,tracking lost
414,15.0,4555.0,,18/01/2024 08:05,
415,11.0,2505.0,form_fill,2024-01-17 07:41:00,Browser: Chrome
416,2.0,2890.0,form_fill,01-30-2024 12:03,
417,10.0,3357.0,form_fill,01-26-2024 06:25,
418,13.0,2209.0,Email Open,15/01/2024 06:24,tracking lost
419,15.0,1988.0,EMAIL_CLICK,28/01/2024 17:46,unknown
420,12.0,1280.0,email_open,11/01/2024 03:28,unknown
421,5.0,4320.0,web-visit,01-17-2024 12:07,utm=xyz
422,1.0,1315.0,form_fill,2024-01-17 12:40:00,unknown
423,10.0,3341.0,EMAIL_CLICK,01-15-2024 21:26,Browser: Chrome
424,8.0,2045.0,web-visit,01-26-2024 12:12,Browser: Chrome
425,10.0,2512.0,email_open,28/01/2024 21:39,unknown
426,13.0,2811.0,form_fill,2024-01-27 06:49:00,
427,14.0,2757.0,form_fill,01-29-2024 17:33,
428,15.0,4715.0,form_fill,2024-01-29 13:48:00,
429,3.0,3091.0,EMAIL_CLICK,06/01/2024 17:45,Firefox
430,6.0,3131.0,Email Open,01-19-2024 22:38,unknown
431,6.0,1003.0,Email Open,2024-01-12 02:36:00,Browser: Chrome
432,10.0,3750.0,web_visit,01-11-2024 04:00,
433,7.0,4100.0,,26/01/2024 18:11,utm=xyz
434,7.0,2033.0,form_fill,2024-01-26 15:43:00,tracking lost
435,4.0,2164.0,email_open,24/01/2024 17:25,
436,7.0,2056.0,web_visit,22/01/2024 08:56,tracking lost
437,3.0,1536.0,web_visit,2024-01-05 15:50:00,
438,1.0,4449.0,FORMFILL,2024-01-12 10:34:00,
439,9.0,1838.0,email_open,23/01/2024 21:23,unknown
440,7.0,1059.0,web_visit,2024-01-10 02:16:00,unknown
441,3.0,3074.0,form_fill,2024-01-03 07:10:00,
442,13.0,3312.0,,2024-01-11 04:49:00,tracking lost
443,6.0,3949.0,email_open,01-15-2024 19:26,
444,11.0,2889.0,web_visit,11/01/2024 03:54,utm=xyz
445,5.0,2780.0,EMAIL_CLICK,01-12-2024 22:39,
446,15.0,3425.0,FORMFILL,2024-01-27 23:52:00,
447,7.0,3121.0,email_open,18/01/2024 01:40,unknown
448,5.0,1801.0,FORMFILL,01-14-2024 20:37,
449,11.0,1531.0,FORMFILL,2024-01-07 10:30:00,Firefox
450,13.0,3931.0,web-visit,09/01/2024 08:49,Firefox
451,13.0,3839.0,web_visit,17/01/2024 01:06,tracking lost
452,8.0,3713.0,web-visit,01-16-2024 17:19,Firefox
453,14.0,4945.0,email_click,24/01/2024 06:03,utm=xyz
454,3.0,1714.0,email_click,11/01/2024 06:41,
455,2.0,3916.0,form_fill,01-12-2024 00:44,tracking lost
456,4.0,3910.0,EMAIL_CLICK,20/01/2024 01:03,utm=xyz
457,6.0,2962.0,Email Open,01-22-2024 23:04,
458,9.0,1837.0,email_click,01-01-2024 10:24,
459,15.0,4995.0,email_click,2024-01-15 12:36:00,tracking lost
460,2.0,1718.0,form_fill,01-27-2024 17:12,
461,1.0,1838.0,FORMFILL,02/01/2024 17:33,Browser: Chrome
462,1.0,2296.0,,14/01/2024 22:07,
463,2.0,4987.0,email_click,21/01/2024 11:07,Browser: Chrome
464,11.0,3575.0,form_fill,27/01/2024 02:08,
465,4.0,3848.0,form_fill,2024-01-17 13:27:00,
466,14.0,3231.0,form_fill,20/01/2024 01:00,unknown
467,15.0,1604.0,form_fill,2024-01-18 15:20:00,Browser: Chrome
468,10.0,3514.0,,06/01/2024 01:35,Browser: Chrome
469,7.0,1452.0,form_fill,2024-01-04 02:46:00,
470,5.0,4072.0,EMAIL_CLICK,2024-01-30 17:34:00,
471,15.0,4108.0,web-visit,01-20-2024 03:30,tracking lost
472,14.0,4676.0,EMAIL_CLICK,2024-01-21 03:24:00,
473,14.0,3190.0,FORMFILL,2024-01-27 02:41:00,unknown
474,6.0,2461.0,,01-24-2024 10:13,
475,8.0,2997.0,Email Open,01-26-2024 12:34,
476,4.0,1714.0,Email Open,2024-01-11 16:27:00,
477,11.0,3317.0,form_fill,12/01/2024 19:59,utm=xyz
478,3.0,1708.0,web-visit,10/01/2024 23:27,
479,9.0,1812.0,EMAIL_CLICK,12/01/2024 01:15,
480,13.0,3109.0,email_click,01-06-2024 10:13,
481,13.0,1073.0,EMAIL_CLICK,29/01/2024 15:36,tracking lost
482,3.0,4781.0,email_open,01-28-2024 12:46,
483,10.0,3295.0,web_visit,2024-01-26 00:12:00,
484,10.0,1872.0,web_visit,2024-01-07 06:04:00,unknown
485,15.0,4469.0,email_click,27/01/2024 11:30,unknown
486,11.0,2997.0,EMAIL_CLICK,2024-01-10 01:01:00,unknown
487,11.0,1254.0,form_fill,2024-01-02 15:41:00,unknown
488,1.0,3879.0,email_click,04/01/2024 01:55,
489,5.0,2472.0,email_click,01-07-2024 21:13,
490,7.0,4308.0,,01-09-2024 04:03,unknown
491,15.0,2584.0,form_fill,2024-01-04 07:21:00,
492,5.0,2007.0,web_visit,01-28-2024 20:02,utm=xyz
493,10.0,3311.0,email_open,01-01-2024 04:57,utm=xyz
494,11.0,2147.0,EMAIL_CLICK,01-15-2024 14:09,unknown
495,8.0,1279.0,form_fill,19/01/2024 12:14,
496,9.0,3553.0,Email Open,19/01/2024 04:34,
497,10.0,3175.0,EMAIL_CLICK,2024-01-13 00:12:00,utm=xyz
498,12.0,4458.0,Email Open,22/01/2024 21:31,
499,11.0,4414.0,EMAIL_CLICK,29/01/2024 09:41,utm=xyz
500,15.0,3956.0,web_visit,2024-01-19 21:28:00,Firefox
501,8.0,3090.0,Email Open,03/01/2024 02:08,tracking lost
502,8.0,1976.0,email_open,01-26-2024 17:04,
503,5.0,3387.0,email_click,2024-01-25 23:13:00,
504,4.0,3278.0,email_click,2024-01-29 00:48:00,utm=xyz
505,10.0,4869.0,form_fill,01-18-2024 14:26,
506,13.0,3538.0,email_click,01-19-2024 04:03,
507,1.0,4967.0,,27/01/2024 03:20,tracking lost
508,15.0,2021.0,,01-11-2024 01:31,utm=xyz
509,12.0,2585.0,form_fill,17/01/2024 11:01,
510,3.0,3116.0,,01-09-2024 09:13,Browser: Chrome
511,8.0,3650.0,web_visit,2024-01-19 02:50:00,Firefox
512,1.0,4959.0,FORMFILL,01-02-2024 07:05,unknown
513,3.0,4295.0,FORMFILL,01-30-2024 02:48,Browser: Chrome
514,5.0,1584.0,Email Open,11/01/2024 16:41,utm=xyz
515,13.0,3364.0,email_click,30/01/2024 12:04,Browser: Chrome
516,7.0,1224.0,web_visit,2024-01-02 09:14:00,
517,4.0,4656.0,email_click,25/01/2024 08:59,
518,14.0,3087.0,form_fill,04/01/2024 09:37,
519,4.0,3749.0,Email Open,2024-01-04 23:49:00,Browser: Chrome
520,10.0,2298.0,form_fill,01-28-2024 04:48,utm=xyz
521,4.0,2906.0,email_click,01-21-2024 08:09,tracking lost
522,2.0,2270.0,,01-20-2024 11:43,Browser: Chrome
523,10.0,3861.0,web_visit,2024-01-29 03:05:00,Firefox
524,10.0,4494.0,FORMFILL,01/01/2024 01:42,tracking lost
525,14.0,3894.0,,2024-01-15 12:14:00,
526,14.0,2655.0,FORMFILL,2024-01-03 23:28:00,
527,2.0,3068.0,form_fill,2024-01-21 04:05:00,
528,9.0,2149.0,web_visit,12/01/2024 23:32,tracking lost
529,12.0,3718.0,form_fill,13/01/2024 05:36,unknown
530,10.0,3955.0,web_visit,11/01/2024 22:20,utm=xyz
531,14.0,3595.0,web-visit,01/01/2024 00:44,
532,13.0,3507.0,FORMFILL,01-21-2024 01:43,tracking lost
533,10.0,4111.0,Email Open,09/01/2024 08:54,
534,3.0,3856.0,FORMFILL,10/01/2024 13:33,tracking lost
535,14.0,4460.0,FORMFILL,15/01/2024 14:40,
536,7.0,1129.0,email_click,19/01/2024 12:50,unknown
537,14.0,4462.0,form_fill,01-17-2024 02:19,unknown
538,6.0,1314.0,Email Open,19/01/2024 10:20,utm=xyz
539,6.0,3016.0,form_fill,01-16-2024 03:28,Firefox
540,14.0,1923.0,email_open,2024-01-25 08:22:00,unknown
541,4.0,1984.0,,2024-01-16 16:55:00,utm=xyz
542,3.0,2546.0,web_visit,26/01/2024 14:31,
543,5.0,3941.0,EMAIL_CLICK,09/01/2024 23:46,tracking lost
544,1.0,2348.0,EMAIL_CLICK,01-11-2024 07:53,Firefox
545,10.0,3054.0,web_visit,01/01/2024 00:03,Browser: Chrome
546,8.0,4968.0,email_click,2024-01-01 18:04:00,
547,7.0,2988.0,email_open,01-19-2024 07:01,utm=xyz
548,14.0,2517.0,,2024-01-03 20:18:00,unknown
549,6.0,1065.0,EMAIL_CLICK,01-09-2024 15:05,
550,10.0,4347.0,web-visit,01-08-2024 15:03,tracking lost
551,10.0,1636.0,FORMFILL,25/01/2024 05:09,Browser: Chrome
552,8.0,2180.0,web_visit,2024-01-18 23:53:00,utm=xyz
553,2.0,1636.0,FORMFILL,2024-01-21 03:51:00,
554,11.0,1879.0,web-visit,01-27-2024 15:50,
555,9.0,1056.0,web_visit,01-29-2024 13:20,
556,15.0,2022.0,web_visit,01-12-2024 17:32,utm=xyz
557,2.0,1150.0,,01-18-2024 06:55,utm=xyz
558,12.0,4730.0,Email Open,03/01/2024 05:21,
559,4.0,3255.0,form_fill,01-01-2024 16:50,Browser: Chrome
560,8.0,1931.0,EMAIL_CLICK,01-13-2024 18:58,Browser: Chrome
561,14.0,4281.0,FORMFILL,16/01/2024 22:28,utm=xyz
562,1.0,1346.0,EMAIL_CLICK,20/01/2024 16:37,
563,9.0,3958.0,EMAIL_CLICK,26/01/2024 01:24,Firefox
564,6.0,2489.0,FORMFILL,01-03-2024 13:02,Browser: Chrome
565,13.0,3423.0,web_visit,01-14-2024 23:01,
566,1.0,3438.0,EMAIL_CLICK,2024-01-21 18:28:00,
567,11.0,2244.0,Email Open,25/01/2024 21:27,Firefox
568,5.0,1318.0,Email Open,01-13-2024 20:18,utm=xyz
569,12.0,2351.0,Email Open,2024-01-03 07:19:00,Firefox
570,11.0,3247.0,Email Open,2024-01-23 04:39:00,Browser: Chrome
571,11.0,2627.0,EMAIL_CLICK,2024-01-10 05:29:00,utm=xyz
572,10.0,1990.0,,2024-01-04 00:51:00,
573,8.0,2053.0,web_visit,28/01/2024 00:22,utm=xyz
574,6.0,4458.0,email_click,01-03-2024 16:41,Browser: Chrome
575,1.0,2677.0,,01-02-2024 08:47,tracking lost
576,1.0,3186.0,web-visit,2024-01-13 05:13:00,
577,13.0,1257.0,,01-18-2024 05:54,
578,9.0,2042.0,email_click,30/01/2024 19:48,unknown
579,11.0,1708.0,EMAIL_CLICK,11/01/2024 17:53,utm=xyz
580,6.0,4498.0,email_open,01-12-2024 06:01,
581,2.0,4391.0,email_click,03/01/2024 13:12,utm=xyz
582,12.0,1742.0,,21/01/2024 12:48,
583,7.0,2106.0,FORMFILL,2024-01-30 05:05:00,Browser: Chrome
584,6.0,3896.0,web-visit,2024-01-13 00:43:00,
585,6.0,1354.0,,2024-01-16 09:31:00,
586,10.0,4085.0,form_fill,2024-01-23 13:13:00,tracking lost
587,10.0,4363.0,email_click,30/01/2024 19:25,Browser: Chrome
588,5.0,1577.0,FORMFILL,08/01/2024 03:16,Firefox
589,11.0,2785.0,form_fill,24/01/2024 17:30,tracking lost
590,8.0,3920.0,Email Open,2024-01-25 04:17:00,
591,10.0,4711.0,EMAIL_CLICK,03/01/2024 14:28,
592,2.0,3466.0,Email Open,01-04-2024 04:43,tracking lost
593,11.0,2861.0,FORMFILL,2024-01-09 20:46:00,Browser: Chrome
594,11.0,2401.0,form_fill,09/01/2024 03:46,Browser: Chrome
595,14.0,3897.0,web_visit,24/01/2024 05:54,utm=xyz
596,7.0,1826.0,Email Open,26/01/2024 05:31,Browser: Chrome
597,15.0,1159.0,email_open,2024-01-08 12:36:00,
598,1.0,4775.0,email_click,25/01/2024 20:07,
599,11.0,4538.0,form_fill,28/01/2024 06:11,
600,9.0,4954.0,Email Open,18/01/2024 01:00,tracking lost
601,6.0,4718.0,EMAIL_CLICK,01-13-2024 01:22,Browser: Chrome
602,15.0,2939.0,web-visit,14/01/2024 17:06,
603,12.0,2348.0,FORMFILL,18/01/2024 19:44,tracking lost
604,13.0,1703.0,web-visit,13/01/2024 03:41,
605,5.0,4590.0,email_open,05/01/2024 20:16,Firefox
606,14.0,2774.0,web_visit,2024-01-28 07:55:00,tracking lost
607,15.0,3572.0,web_visit,16/01/2024 22:40,utm=xyz
608,3.0,1695.0,,01-18-2024 09:53,tracking lost
609,2.0,2429.0,email_open,01-25-2024 14:55,tracking lost
610,2.0,4335.0,FORMFILL,2024-01-12 03:47:00,utm=xyz
611,12.0,2264.0,FORMFILL,2024-01-06 05:29:00,
612,9.0,2518.0,FORMFILL,01-05-2024 23:11,utm=xyz
613,9.0,1708.0,FORMFILL,01-02-2024 06:50,unknown
614,13.0,3140.0,EMAIL_CLICK,19/01/2024 23:19,unknown
615,11.0,2845.0,Email Open,01-13-2024 23:05,utm=xyz
616,2.0,4142.0,web_visit,01-19-2024 08:09,Firefox
617,13.0,2661.0,email_click,01-28-2024 13:20,Browser: Chrome
618,5.0,2381.0,email_open,2024-01-23 09:57:00,
619,1.0,3942.0,Email Open,2024-01-07 15:07:00,Browser: Chrome
620,6.0,1649.0,web_visit,17/01/2024 03:50,
621,7.0,4625.0,email_click,03/01/2024 21:13,
622,13.0,4955.0,form_fill,29/01/2024 15:07,Browser: Chrome
623,12.0,2871.0,FORMFILL,01-27-2024 02:34,
624,1.0,2442.0,,01-29-2024 19:36,utm=xyz
625,7.0,2315.0,EMAIL_CLICK,03/01/2024 22:26,
626,4.0,1258.0,Email Open,04/01/2024 08:48,tracking lost
627,13.0,4809.0,Email Open,13/01/2024 06:42,
628,3.0,4260.0,form_fill,2024-01-11 21:37:00,
629,4.0,2071.0,Email Open,01-21-2024 15:54,unknown
630,4.0,3482.0,,09/01/2024 13:38,Firefox
631,13.0,4080.0,email_open,06/01/2024 13:45,tracking lost
632,2.0,3942.0,,2024-01-08 22:10:00,tracking lost
633,11.0,3918.0,Email Open,2024-01-20 00:03:00,utm=xyz
634,6.0,4297.0,,30/01/2024 03:17,Firefox
635,8.0,1334.0,web_visit,11/01/2024 14:54,unknown
636,9.0,2929.0,form_fill,2024-01-13 01:18:00,Browser: Chrome
637,15.0,1627.0,form_fill,2024-01-12 22:54:00,
638,13.0,4067.0,web-visit,01-24-2024 05:56,
639,6.0,3531.0,FORMFILL,2024-01-30 11:08:00,
640,5.0,3257.0,form_fill,01-21-2024 03:14,unknown
641,5.0,1301.0,EMAIL_CLICK,01-12-2024 20:38,tracking lost
642,13.0,3879.0,EMAIL_CLICK,08/01/2024 18:38,unknown
643,3.0,2532.0,web-visit,01-07-2024 18:29,
644,15.0,2581.0,Email Open,2024-01-03 07:10:00,Browser: Chrome
645,2.0,1665.0,,2024-01-06 17:51:00,
646,2.0,1574.0,FORMFILL,2024-01-25 18:56:00,
647,6.0,3838.0,,2024-01-26 23:13:00,tracking lost
648,6.0,1055.0,EMAIL_CLICK,2024-01-08 02:36:00,unknown
649,6.0,1171.0,web-visit,11/01/2024 23:20,tracking lost
650,10.0,4048.0,web_visit,01-25-2024 02:51,
651,5.0,4994.0,email_click,01-19-2024 10:22,utm=xyz
652,8.0,4653.0,form_fill,01-17-2024 17:27,
653,6.0,4796.0,Email Open,01-08-2024 00:23,utm=xyz
654,5.0,3841.0,EMAIL_CLICK,01-24-2024 17:19,Firefox
655,11.0,4722.0,EMAIL_CLICK,2024-01-12 07:07:00,unknown
656,13.0,3074.0,Email Open,01-13-2024 11:44,
657,14.0,3322.0,Email Open,01/01/2024 07:25,unknown
658,3.0,4084.0,web-visit,2024-01-26 19:19:00,
659,3.0,2406.0,web_visit,01-27-2024 06:15,
660,2.0,3883.0,EMAIL_CLICK,05/01/2024 11:33,tracking lost
661,4.0,3253.0,Email Open,2024-01-01 17:08:00,tracking lost
662,2.0,2407.0,form_fill,01-20-2024 04:54,
663,2.0,3183.0,email_open,23/01/2024 09:59,
664,4.0,2839.0,email_open,2024-01-02 12:13:00,Browser: Chrome
665,5.0,2401.0,web_visit,14/01/2024 20:20,utm=xyz
666,5.0,3753.0,Email Open,01-08-2024 04:49,tracking lost
667,11.0,4711.0,EMAIL_CLICK,01-22-2024 00:29,
668,8.0,3618.0,FORMFILL,2024-01-11 14:14:00,
669,5.0,3869.0,FORMFILL,10/01/2024 11:28,Browser: Chrome
670,9.0,3940.0,web_visit,28/01/2024 00:29,
671,8.0,4330.0,form_fill,27/01/2024 11:10,tracking lost
672,12.0,3821.0,Email Open,01-17-2024 11:55,utm=xyz
673,15.0,4203.0,email_click,2024-01-17 12:08:00,Browser: Chrome
674,15.0,1328.0,email_click,01-02-2024 13:03,
675,2.0,2891.0,web_visit,2024-01-26 22:14:00,utm=xyz
676,2.0,2274.0,Email Open,2024-01-03 10:06:00,
677,9.0,4844.0,FORMFILL,01-24-2024 02:19,
678,5.0,4043.0,FORMFILL,22/01/2024 21:48,
679,11.0,2764.0,form_fill,01-14-2024 23:48,
680,1.0,2676.0,web-visit,06/01/2024 04:20,
681,11.0,3841.0,EMAIL_CLICK,27/01/2024 16:57,unknown
682,9.0,2323.0,web_visit,2024-01-26 23:39:00,
683,7.0,3590.0,form_fill,01-28-2024 13:10,tracking lost
684,15.0,1940.0,email_open,06/01/2024 23:34,
685,12.0,2892.0,email_open,2024-01-27 02:46:00,tracking lost
686,13.0,4741.0,web_visit,2024-01-13 23:53:00,
687,8.0,2479.0,EMAIL_CLICK,01-27-2024 02:22,tracking lost
688,5.0,3676.0,Email Open,25/01/2024 17:19,
689,1.0,2161.0,form_fill,2024-01-26 18:59:00,Firefox
690,14.0,1819.0,EMAIL_CLICK,09/01/2024 10:45,utm=xyz
691,2.0,4118.0,FORMFILL,2024-01-19 05:32:00,tracking lost
692,8.0,1881.0,form_fill,01-20-2024 12:32,
693,5.0,3424.0,email_click,01-29-2024 02:50,
694,15.0,3278.0,EMAIL_CLICK,02/01/2024 09:36,Browser: Chrome
695,5.0,1879.0,form_fill,2024-01-02 09:17:00,
696,6.0,3680.0,web_visit,09/01/2024 19:24,
697,8.0,2725.0,web_visit,2024-01-28 18:38:00,Firefox
698,11.0,1444.0,Email Open,2024-01-07 10:23:00,
699,4.0,2881.0,email_open,2024-01-02 05:46:00,
700,6.0,2984.0,email_click,2024-01-03 14:52:00,
701,6.0,3130.0,web_visit,2024-01-21 05:44:00,Firefox
702,11.0,2722.0,Email Open,01-14-2024 06:43,utm=xyz
703,5.0,3306.0,web-visit,01-03-2024 00:57,tracking lost
704,15.0,2320.0,email_open,2024-01-16 17:11:00,
705,4.0,4794.0,web-visit,01-16-2024 22:31,
706,9.0,3132.0,,02/01/2024 07:54,unknown
707,1.0,2543.0,email_click,01-07-2024 11:07,unknown
708,13.0,1351.0,email_click,01-02-2024 03:37,
709,6.0,1819.0,FORMFILL,2024-01-01 17:54:00,utm=xyz
710,10.0,2639.0,EMAIL_CLICK,01-08-2024 12:36,Firefox
711,8.0,3858.0,email_click,01-24-2024 22:33,
712,2.0,2145.0,web-visit,27/01/2024 12:06,Firefox
713,10.0,1584.0,,2024-01-17 02:17:00,Firefox
714,13.0,3247.0,Email Open,2024-01-16 06:10:00,
715,8.0,2506.0,email_open,2024-01-18 11:34:00,utm=xyz
716,14.0,1324.0,,17/01/2024 16:49,utm=xyz
717,2.0,2375.0,web_visit,01-09-2024 20:10,
718,1.0,2557.0,EMAIL_CLICK,2024-01-03 04:25:00,Firefox
719,1.0,2658.0,email_open,24/01/2024 17:36,Firefox
720,14.0,1159.0,form_fill,01-28-2024 08:00,Browser: Chrome
721,3.0,1522.0,email_open,2024-01-25 00:02:00,
722,9.0,2868.0,form_fill,01-21-2024 07:31,
723,10.0,4479.0,Email Open,01-27-2024 16:09,
724,3.0,3507.0,Email Open,2024-01-18 00:35:00,
725,13.0,2847.0,FORMFILL,23/01/2024 02:11,utm=xyz
726,3.0,4094.0,Email Open,2024-01-13 09:28:00,
727,7.0,3737.0,form_fill,28/01/2024 13:07,Browser: Chrome
728,3.0,1202.0,,2024-01-12 08:41:00,tracking lost
729,13.0,1360.0,form_fill,01-04-2024 11:07,
730,9.0,2581.0,email_open,2024-01-21 12:33:00,Firefox
731,13.0,2114.0,,2024-01-10 06:33:00,unknown
732,4.0,4141.0,,01-29-2024 03:29,
733,7.0,1207.0,Email Open,2024-01-15 14:22:00,
734,4.0,2669.0,email_open,2024-01-18 07:15:00,Firefox
735,7.0,2323.0,email_click,01-20-2024 14:47,utm=xyz
736,3.0,4573.0,web_visit,01-21-2024 07:05,
737,13.0,1997.0,email_open,01-10-2024 11:05,
738,12.0,4812.0,web-visit,01-25-2024 23:49,
739,7.0,2832.0,Email Open,01-23-2024 03:13,utm=xyz
740,2.0,2647.0,email_open,2024-01-11 20:02:00,Firefox
741,7.0,4333.0,email_click,2024-01-13 08:23:00,tracking lost
742,15.0,4700.0,EMAIL_CLICK,27/01/2024 16:41,
743,14.0,4932.0,email_open,01-13-2024 07:08,Firefox
744,1.0,3251.0,email_open,24/01/2024 16:12,
745,15.0,2393.0,EMAIL_CLICK,2024-01-28 09:17:00,Firefox
746,11.0,3123.0,FORMFILL,10/01/2024 01:18,
747,3.0,2479.0,Email Open,01-27-2024 10:31,
748,12.0,2020.0,,2024-01-03 16:30:00,unknown
749,15.0,2800.0,FORMFILL,01-14-2024 10:30,Firefox
750,14.0,1752.0,email_click,02/01/2024 10:11,
751,15.0,1282.0,form_fill,01-07-2024 15:18,tracking lost
752,8.0,1558.0,web_visit,01-04-2024 12:48,
753,2.0,2260.0,email_open,06/01/2024 02:47,Browser: Chrome
754,1.0,2514.0,FORMFILL,05/01/2024 10:38,
755,1.0,1206.0,FORMFILL,01-06-2024 22:52,tracking lost
756,11.0,3471.0,EMAIL_CLICK,2024-01-11 23:21:00,
757,15.0,2933.0,FORMFILL,01-13-2024 17:45,Browser: Chrome
758,15.0,3017.0,form_fill,26/01/2024 21:28,
759,11.0,1378.0,FORMFILL,2024-01-25 15:13:00,utm=xyz
760,2.0,1130.0,Email Open,2024-01-05 18:51:00,
761,6.0,2462.0,EMAIL_CLICK,2024-01-23 22:28:00,unknown
762,4.0,2572.0,EMAIL_CLICK,01-30-2024 17:39,
763,7.0,3118.0,email_click,2024-01-08 11:41:00,unknown
764,2.0,1673.0,Email Open,01-02-2024 22:35,
765,5.0,1309.0,email_click,01-08-2024 18:28,
766,5.0,1346.0,FORMFILL,17/01/2024 22:08,utm=xyz
767,3.0,1912.0,,14/01/2024 18:17,
768,14.0,2292.0,form_fill,29/01/2024 11:22,utm=xyz
769,8.0,3308.0,FORMFILL,04/01/2024 05:04,tracking lost
770,4.0,2216.0,web-visit,2024-01-27 16:47:00,
771,8.0,2056.0,,03/01/2024 13:12,unknown
772,1.0,1275.0,FORMFILL,08/01/2024 15:08,
773,7.0,4824.0,email_click,01-24-2024 20:40,
774,11.0,2488.0,FORMFILL,2024-01-29 01:10:00,unknown
775,15.0,3853.0,email_open,01-05-2024 09:51,
776,14.0,4852.0,EMAIL_CLICK,01-07-2024 03:04,Firefox
777,9.0,4408.0,FORMFILL,13/01/2024 05:36,utm=xyz
778,12.0,2137.0,FORMFILL,01-11-2024 05:03,Firefox
779,2.0,4969.0,email_open,01-20-2024 23:04,unknown
780,4.0,1608.0,web_visit,25/01/2024 07:14,
781,3.0,1954.0,form_fill,01-05-2024 20:42,Browser: Chrome
782,2.0,3105.0,Email Open,01-24-2024 13:26,
783,2.0,4139.0,EMAIL_CLICK,01-12-2024 06:31,Firefox
784,14.0,3955.0,web-visit,2024-01-01 14:14:00,unknown
785,2.0,3584.0,,24/01/2024 05:17,utm=xyz
786,7.0,4192.0,email_open,2024-01-13 03:08:00,Browser: Chrome
787,15.0,3593.0,web-visit,01-04-2024 09:51,tracking lost
788,14.0,4693.0,FORMFILL,01-12-2024 23:03,
789,4.0,3535.0,web_visit,2024-01-24 17:58:00,unknown
790,6.0,2228.0,form_fill,01-25-2024 14:43,Firefox
791,5.0,1281.0,web-visit,18/01/2024 03:30,utm=xyz
792,3.0,1217.0,email_click,01-25-2024 02:03,Browser: Chrome
793,11.0,2005.0,web_visit,11/01/2024 03:52,unknown
794,6.0,2919.0,email_open,08/01/2024 09:38,
795,4.0,1765.0,form_fill,17/01/2024 05:39,tracking lost
796,8.0,1438.0,email_open,01-25-2024 16:11,Browser: Chrome
797,5.0,4263.0,FORMFILL,2024-01-29 03:36:00,
798,8.0,1733.0,Email Open,09/01/2024 03:33,Browser: Chrome
799,10.0,1591.0,form_fill,19/01/2024 23:05,
800,14.0,1948.0,FORMFILL,01-20-2024 08:03,Firefox
801,10.0,3972.0,email_open,01-28-2024 09:11,unknown
802,1.0,4304.0,web-visit,01-22-2024 19:03,Firefox
803,15.0,4691.0,Email Open,02/01/2024 09:21,
804,3.0,2931.0,EMAIL_CLICK,09/01/2024 01:00,
805,14.0,4335.0,,01-12-2024 18:12,
806,7.0,2104.0,,23/01/2024 02:46,Browser: Chrome
807,15.0,4510.0,web-visit,23/01/2024 14:32,
808,8.0,2966.0,email_click,01-15-2024 17:11,
809,14.0,1263.0,,2024-01-23 02:07:00,
810,15.0,4298.0,Email Open,16/01/2024 00:27,Browser: Chrome
811,14.0,4041.0,FORMFILL,01-26-2024 08:20,
812,6.0,2156.0,web-visit,2024-01-30 18:00:00,
813,6.0,4272.0,email_click,2024-01-26 14:27:00,unknown
814,10.0,3351.0,Email Open,09/01/2024 03:37,
815,7.0,4462.0,,09/01/2024 23:59,Browser: Chrome
816,11.0,2888.0,,2024-01-24 13:29:00,unknown
817,11.0,3418.0,email_open,12/01/2024 21:12,Firefox
818,6.0,4404.0,form_fill,01-07-2024 02:43,
819,6.0,1786.0,form_fill,30/01/2024 08:20,Firefox
820,12.0,4461.0,web-visit,01-11-2024 14:39,utm=xyz
821,12.0,2303.0,email_open,2024-01-06 03:47:00,
822,8.0,2390.0,email_click,04/01/2024 04:15,unknown
823,5.0,3326.0,email_open,2024-01-30 17:28:00,Browser: Chrome
824,14.0,3917.0,Email Open,2024-01-15 12:03:00,
825,12.0,3365.0,web-visit,01-16-2024 06:37,tracking lost
826,9.0,3861.0,Email Open,2024-01-01 17:54:00,tracking lost
827,15.0,1442.0,Email Open,01-23-2024 02:10,
828,13.0,1076.0,email_open,2024-01-16 17:27:00,
829,1.0,1409.0,email_click,01-12-2024 21:08,unknown
830,8.0,2983.0,email_open,2024-01-08 23:37:00,
831,11.0,2872.0,Email Open,12/01/2024 18:22,Browser: Chrome
832,6.0,3255.0,email_open,2024-01-06 17:22:00,unknown
833,9.0,4741.0,form_fill,16/01/2024 03:05,
834,2.0,1399.0,email_open,2024-01-18 08:27:00,unknown
835,12.0,1255.0,,01-10-2024 14:26,
836,1.0,2107.0,email_click,2024-01-16 10:22:00,
837,7.0,3070.0,EMAIL_CLICK,2024-01-08 05:17:00,Firefox
838,7.0,1978.0,,01-07-2024 09:43,
839,11.0,4964.0,form_fill,2024-01-08 06:42:00,Firefox
840,9.0,2865.0,form_fill,01-20-2024 15:16,utm=xyz
841,8.0,3680.0,web_visit,17/01/2024 13:02,
842,3.0,1221.0,form_fill,2024-01-24 22:03:00,
843,12.0,2548.0,email_open,29/01/2024 17:02,utm=xyz
844,9.0,4058.0,email_open,01-09-2024 16:24,
845,13.0,3445.0,EMAIL_CLICK,04/01/2024 15:52,
846,5.0,2692.0,form_fill,01-28-2024 19:27,Firefox
847,3.0,1449.0,Email Open,12/01/2024 20:07,tracking lost
848,12.0,1275.0,email_open,01-03-2024 10:28,
849,10.0,3966.0,email_open,15/01/2024 18:17,Firefox
850,14.0,1802.0,EMAIL_CLICK,03/01/2024 20:57,unknown
851,4.0,2278.0,form_fill,12/01/2024 03:37,Firefox
852,15.0,1928.0,FORMFILL,2024-01-06 11:41:00,utm=xyz
853,5.0,3783.0,Email Open,01-27-2024 09:21,utm=xyz
854,1.0,4973.0,EMAIL_CLICK,01-10-2024 05:57,utm=xyz
855,3.0,1557.0,EMAIL_CLICK,2024-01-22 20:24:00,tracking lost
856,4.0,2213.0,FORMFILL,2024-01-19 02:53:00,
857,2.0,3868.0,EMAIL_CLICK,15/01/2024 01:41,Browser: Chrome
858,7.0,1838.0,EMAIL_CLICK,01-25-2024 04:25,Browser: Chrome
859,1.0,1247.0,web-visit,02/01/2024 23:10,
860,9.0,1722.0,web_visit,2024-01-19 15:46:00,utm=xyz
861,8.0,3045.0,FORMFILL,2024-01-20 23:54:00,
862,14.0,2401.0,,02/01/2024 01:29,
863,8.0,3896.0,FORMFILL,14/01/2024 14:16,Browser: Chrome
864,10.0,3274.0,FORMFILL,01-20-2024 18:06,
865,15.0,4283.0,email_open,08/01/2024 08:26,unknown
866,1.0,1488.0,form_fill,2024-01-17 03:24:00,
867,4.0,4327.0,EMAIL_CLICK,2024-01-26 19:36:00,Browser: Chrome
868,14.0,4759.0,Email Open,01-06-2024 19:57,
869,4.0,2151.0,EMAIL_CLICK,2024-01-28 23:59:00,tracking lost
870,12.0,2460.0,EMAIL_CLICK,01-18-2024 14:39,tracking lost
871,12.0,1801.0,web_visit,01-01-2024 17:50,
872,5.0,4475.0,email_open,01-18-2024 10:19,
873,9.0,3756.0,email_click,12/01/2024 07:55,Firefox
874,3.0,2454.0,email_click,2024-01-04 00:43:00,utm=xyz
875,6.0,3020.0,EMAIL_CLICK,2024-01-27 20:25:00,
876,7.0,1140.0,form_fill,01-24-2024 18:23,
877,15.0,1027.0,form_fill,2024-01-01 01:39:00,Browser: Chrome
878,15.0,3907.0,Email Open,05/01/2024 08:37,utm=xyz
879,1.0,1345.0,web_visit,01-30-2024 03:28,
880,4.0,1699.0,EMAIL_CLICK,2024-01-20 23:04:00,unknown
881,14.0,3522.0,FORMFILL,2024-01-16 12:28:00,
882,2.0,2772.0,web-visit,01/01/2024 22:10,Firefox
883,4.0,4371.0,email_open,01-13-2024 17:14,unknown
884,3.0,2457.0,email_click,2024-01-27 20:51:00,
885,8.0,1794.0,FORMFILL,27/01/2024 03:20,tracking lost
886,10.0,3210.0,FORMFILL,14/01/2024 08:22,tracking lost
887,10.0,3296.0,web-visit,26/01/2024 03:19,
888,15.0,1337.0,EMAIL_CLICK,01-27-2024 06:48,
889,8.0,2635.0,web-visit,01-06-2024 00:39,
890,9.0,3990.0,email_click,30/01/2024 16:44,Browser: Chrome
891,12.0,3806.0,email_click,12/01/2024 16:25,
892,9.0,3614.0,EMAIL_CLICK,29/01/2024 17:52,tracking lost
893,1.0,2146.0,EMAIL_CLICK,2024-01-20 12:31:00,utm=xyz
894,9.0,1340.0,email_click,03/01/2024 13:49,unknown
895,9.0,2729.0,email_open,01-14-2024 14:23,utm=xyz
896,9.0,1798.0,Email Open,01-09-2024 01:48,
897,6.0,3107.0,web-visit,2024-01-06 11:59:00,Firefox
898,6.0,2951.0,EMAIL_CLICK,2024-01-11 14:44:00,unknown
899,12.0,2072.0,web_visit,10/01/2024 16:38,Browser: Chrome
900,6.0,2976.0,web_visit,01-08-2024 01:25,Firefox
901,13.0,1933.0,web_visit,01-22-2024 14:52,unknown
902,1.0,1392.0,form_fill,2024-01-01 19:21:00,
903,4.0,2083.0,web_visit,2024-01-07 10:51:00,
904,2.0,1763.0,web_visit,2024-01-22 05:04:00,unknown
905,7.0,4903.0,email_open,08/01/2024 02:41,
906,11.0,2370.0,FORMFILL,2024-01-21 01:35:00,
907,13.0,2742.0,Email Open,2024-01-19 17:25:00,Firefox
908,4.0,4020.0,EMAIL_CLICK,2024-01-04 21:55:00,
909,2.0,1053.0,,08/01/2024 16:35,
910,13.0,4658.0,EMAIL_CLICK,01-03-2024 06:31,Firefox
911,10.0,2540.0,email_click,29/01/2024 03:46,
912,1.0,2525.0,EMAIL_CLICK,01-17-2024 09:13,tracking lost
913,4.0,1651.0,email_click,10/01/2024 16:26,tracking lost
914,1.0,4179.0,,2024-01-13 08:24:00,Browser: Chrome
915,14.0,3830.0,web_visit,01-29-2024 13:56,unknown
916,4.0,3520.0,EMAIL_CLICK,01-27-2024 01:58,
917,4.0,2835.0,web-visit,2024-01-24 12:41:00,
918,4.0,2679.0,form_fill,01-16-2024 15:36,
919,5.0,1602.0,web-visit,06/01/2024 05:13,utm=xyz
920,8.0,4649.0,web_visit,2024-01-28 20:16:00,
921,8.0,1407.0,web_visit,2024-01-04 10:14:00,Firefox
922,10.0,4371.0,,2024-01-26 22:44:00,unknown
923,12.0,3058.0,,01-02-2024 19:14,
924,10.0,4320.0,web_visit,08/01/2024 14:23,Browser: Chrome
925,2.0,2086.0,form_fill,2024-01-20 04:39:00,
926,11.0,2470.0,email_click,01-03-2024 09:58,Browser: Chrome
927,5.0,1079.0,email_click,2024-01-13 23:25:00,
928,4.0,1721.0,web_visit,2024-01-08 09:05:00,
929,14.0,3604.0,FORMFILL,2024-01-12 09:11:00,Firefox
930,10.0,1036.0,web-visit,25/01/2024 00:08,Browser: Chrome
931,11.0,3337.0,EMAIL_CLICK,2024-01-25 07:13:00,utm=xyz
932,14.0,3990.0,web-visit,01-28-2024 06:50,tracking lost
933,12.0,2527.0,form_fill,2024-01-05 10:18:00,
934,1.0,2992.0,FORMFILL,01-08-2024 05:29,tracking lost
935,10.0,1499.0,,2024-01-17 16:52:00,Firefox
936,3.0,3370.0,EMAIL_CLICK,01-23-2024 20:17,Browser: Chrome
937,10.0,2007.0,form_fill,01-30-2024 17:39,
938,10.0,2565.0,,16/01/2024 15:33,tracking lost
939,1.0,1657.0,EMAIL_CLICK,2024-01-14 19:21:00,
940,13.0,1996.0,email_click,2024-01-25 02:44:00,tracking lost
941,9.0,1708.0,Email Open,24/01/2024 18:14,utm=xyz
942,9.0,3190.0,form_fill,01-15-2024 14:08,
943,4.0,4174.0,email_click,01-20-2024 22:55,Browser: Chrome
944,7.0,2587.0,web_visit,01-03-2024 23:15,
945,10.0,4436.0,form_fill,2024-01-30 05:44:00,
946,12.0,3011.0,,2024-01-14 03:55:00,Browser: Chrome
947,4.0,3123.0,EMAIL_CLICK,12/01/2024 12:01,Browser: Chrome
948,9.0,2404.0,Email Open,01-29-2024 12:18,
949,6.0,2447.0,form_fill,2024-01-16 09:44:00,unknown
950,12.0,3868.0,web_visit,2024-01-12 08:12:00,utm=xyz
951,13.0,4624.0,Email Open,2024-01-23 19:48:00,
952,7.0,3767.0,email_open,2024-01-04 07:01:00,Browser: Chrome
953,1.0,3310.0,email_click,18/01/2024 03:28,tracking lost
954,10.0,2603.0,web-visit,2024-01-19 20:04:00,Firefox
955,13.0,2571.0,,23/01/2024 21:00,
956,7.0,2539.0,email_click,05/01/2024 23:51,
957,5.0,4246.0,,28/01/2024 19:56,
958,8.0,2294.0,web-visit,01-12-2024 15:25,unknown
959,3.0,1348.0,email_click,30/01/2024 02:21,utm=xyz
960,11.0,3726.0,Email Open,2024-01-30 09:02:00,
961,7.0,2758.0,email_open,23/01/2024 03:57,
962,11.0,3182.0,email_click,01-11-2024 01:19,
963,4.0,3752.0,Email Open,2024-01-17 21:58:00,utm=xyz
964,7.0,1666.0,Email Open,15/01/2024 13:11,
965,1.0,2848.0,web_visit,01-29-2024 17:26,unknown
966,3.0,4758.0,,01-12-2024 19:44,Firefox
967,15.0,2442.0,email_open,07/01/2024 05:17,unknown
968,1.0,4166.0,form_fill,01-10-2024 19:55,unknown
969,14.0,2405.0,web-visit,20/01/2024 05:35,utm=xyz
970,9.0,3969.0,Email Open,01-04-2024 04:23,utm=xyz
971,2.0,3612.0,web-visit,01-10-2024 11:13,Firefox
972,6.0,2678.0,FORMFILL,01-21-2024 22:47,utm=xyz
973,2.0,3135.0,,01-18-2024 09:17,unknown
974,3.0,1144.0,email_click,2024-01-15 09:01:00,unknown
975,5.0,1132.0,,20/01/2024 17:23,
976,1.0,3269.0,email_click,2024-01-04 06:19:00,utm=xyz
977,6.0,2131.0,email_open,28/01/2024 01:37,
978,11.0,3271.0,web-visit,2024-01-06 07:49:00,
979,14.0,2408.0,,2024-01-13 18:10:00,unknown
980,5.0,4203.0,,2024-01-30 23:51:00,tracking lost
981,7.0,2245.0,,16/01/2024 19:29,utm=xyz
982,6.0,2310.0,,14/01/2024 20:11,
983,12.0,1103.0,email_open,2024-01-28 06:06:00,
984,6.0,3840.0,web-visit,01-28-2024 19:02,
985,11.0,2030.0,Email Open,2024-01-20 21:25:00,unknown
986,1.0,4276.0,FORMFILL,20/01/2024 21:29,tracking lost
987,13.0,1749.0,EMAIL_CLICK,22/01/2024 01:07,Browser: Chrome
988,11.0,4848.0,web-visit,01-21-2024 00:53,unknown
989,1.0,4643.0,email_click,12/01/2024 19:40,Firefox
990,3.0,2272.0,FORMFILL,01-16-2024 16:06,Firefox
991,1.0,3018.0,,01-12-2024 17:16,
992,1.0,3875.0,web-visit,2024-01-21 20:02:00,unknown
993,8.0,1939.0,Email Open,07/01/2024 14:30,Browser: Chrome
994,5.0,1831.0,form_fill,2024-01-09 07:56:00,unknown
995,2.0,3996.0,EMAIL_CLICK,01-13-2024 03:09,unknown
996,12.0,2504.0,email_click,25/01/2024 19:26,
997,2.0,1535.0,email_open,2024-01-24 04:33:00,
998,7.0,1215.0,email_open,2024-01-04 00:24:00,
999,8.0,4016.0,Email Open,03/01/2024 21:35,
1000,13.0,1044.0,FORMFILL,01-25-2024 20:57,
1001,9.0,3647.0,web-visit,2024-01-03 10:28:00,
1002,7.0,2457.0,web_visit,06/01/2024 00:41,unknown
1003,13.0,1922.0,form_fill,13/01/2024 23:37,
1004,9.0,1781.0,web_visit,27/01/2024 16:28,utm=xyz
1005,2.0,3858.0,EMAIL_CLICK,2024-01-21 23:58:00,Browser: Chrome
1006,9.0,4330.0,EMAIL_CLICK,2024-01-01 11:37:00,utm=xyz
1007,9.0,2004.0,EMAIL_CLICK,2024-01-07 20:15:00,unknown
1008,15.0,1907.0,FORMFILL,29/01/2024 09:59,tracking lost
1009,1.0,2074.0,email_open,18/01/2024 18:14,unknown
1010,13.0,3605.0,form_fill,2024-01-10 01:41:00,Firefox
1011,10.0,2824.0,,2024-01-06 03:03:00,Firefox
1012,4.0,4393.0,form_fill,2024-01-11 00:28:00,
1013,14.0,1893.0,email_click,23/01/2024 06:21,tracking lost
1014,7.0,2248.0,email_click,23/01/2024 03:32,utm=xyz
1015,14.0,4563.0,Email Open,2024-01-17 12:22:00,
1016,11.0,1715.0,EMAIL_CLICK,01-30-2024 04:21,Firefox
1017,11.0,1236.0,web_visit,2024-01-26 11:21:00,utm=xyz
1018,15.0,2420.0,web_visit,2024-01-29 06:50:00,
1019,4.0,4528.0,form_fill,2024-01-26 05:06:00,unknown
1020,2.0,3307.0,EMAIL_CLICK,2024-01-14 15:11:00,
1021,13.0,4477.0,form_fill,01-07-2024 17:23,utm=xyz
1022,6.0,4599.0,FORMFILL,01-13-2024 17:10,unknown
1023,15.0,3670.0,web-visit,2024-01-22 05:21:00,
1024,5.0,3765.0,EMAIL_CLICK,25/01/2024 01:30,Browser: Chrome
1025,7.0,3176.0,FORMFILL,2024-01-16 15:16:00,utm=xyz
1026,3.0,1747.0,email_click,2024-01-17 08:47:00,
1027,14.0,1389.0,email_click,2024-01-27 05:51:00,
1028,15.0,2420.0,web_visit,2024-01-27 20:17:00,tracking lost
1029,4.0,3916.0,form_fill,17/01/2024 03:16,
1030,9.0,3626.0,EMAIL_CLICK,27/01/2024 00:50,
1031,6.0,1085.0,web-visit,01/01/2024 05:40,tracking lost
1032,3.0,4543.0,form_fill,12/01/2024 18:42,utm=xyz
1033,8.0,4195.0,,01-26-2024 13:37,
1034,4.0,1367.0,Email Open,01-16-2024 16:14,Browser: Chrome
1035,5.0,1108.0,FORMFILL,01-16-2024 15:08,
1036,6.0,4637.0,web_visit,01-22-2024 20:24,
1037,10.0,3830.0,FORMFILL,01-30-2024 03:36,
1038,11.0,1835.0,web_visit,09/01/2024 10:26,unknown
1039,1.0,4622.0,email_click,2024-01-06 03:39:00,Browser: Chrome
1040,3.0,1846.0,form_fill,01-05-2024 18:21,utm=xyz
1041,4.0,3485.0,form_fill,01-24-2024 14:25,Browser: Chrome
1042,10.0,2553.0,Email Open,26/01/2024 15:08,
1043,11.0,3063.0,email_open,01-01-2024 02:27,
1044,8.0,1429.0,EMAIL_CLICK,01-11-2024 06:48,Firefox
1045,8.0,2143.0,email_click,23/01/2024 20:56,unknown
1046,15.0,2583.0,EMAIL_CLICK,01-24-2024 00:25,Firefox
1047,3.0,3754.0,form_fill,01-25-2024 15:53,tracking lost
1048,15.0,1056.0,EMAIL_CLICK,2024-01-19 23:01:00,
1049,5.0,4197.0,email_click,11/01/2024 17:33,utm=xyz
1050,7.0,3782.0,web_visit,01-22-2024 09:31,unknown
1051,12.0,1162.0,email_open,01-26-2024 23:56,utm=xyz
1052,12.0,4381.0,Email Open,2024-01-02 21:34:00,
1053,2.0,1946.0,,2024-01-14 21:53:00,
1054,3.0,2347.0,email_click,01-24-2024 20:20,
1055,9.0,1688.0,web-visit,02/01/2024 00:33,
1056,4.0,3275.0,FORMFILL,01-13-2024 19:25,utm=xyz
1057,5.0,3459.0,EMAIL_CLICK,01-29-2024 02:07,
1058,4.0,3577.0,web_visit,2024-01-26 20:50:00,Browser: Chrome
1059,4.0,3025.0,,20/01/2024 18:55,Browser: Chrome
1060,14.0,1178.0,web_visit,2024-01-29 04:54:00,tracking lost
1061,11.0,2934.0,email_click,01-23-2024 08:05,
1062,8.0,4711.0,email_open,2024-01-08 08:16:00,tracking lost
1063,1.0,4809.0,,01-10-2024 01:41,utm=xyz
1064,14.0,4817.0,email_open,18/01/2024 18:02,tracking lost
1065,7.0,4102.0,web-visit,2024-01-05 06:24:00,tracking lost
1066,13.0,4011.0,EMAIL_CLICK,2024-01-01 14:37:00,Browser: Chrome
1067,4.0,4482.0,,01-24-2024 21:04,unknown
1068,10.0,1233.0,Email Open,01-07-2024 02:33,
1069,1.0,3698.0,web-visit,01/01/2024 03:14,Browser: Chrome
1070,6.0,3101.0,web-visit,2024-01-27 04:29:00,
1071,12.0,4889.0,web_visit,01-03-2024 19:55,
1072,6.0,3214.0,EMAIL_CLICK,2024-01-17 04:01:00,
1073,2.0,4192.0,web_visit,01-21-2024 06:20,tracking lost
1074,10.0,4505.0,Email Open,01-13-2024 06:50,unknown
1075,6.0,4873.0,FORMFILL,12/01/2024 20:38,Firefox
1076,15.0,3093.0,web_visit,2024-01-10 07:01:00,
1077,15.0,4946.0,EMAIL_CLICK,2024-01-04 17:31:00,
1078,6.0,2458.0,email_open,30/01/2024 06:38,tracking lost
1079,4.0,1761.0,web-visit,18/01/2024 03:08,tracking lost
1080,14.0,3610.0,email_click,01-07-2024 01:02,
1081,2.0,1747.0,web-visit,2024-01-07 19:54:00,
1082,4.0,3763.0,,2024-01-19 07:58:00,
1083,14.0,4019.0,,01-07-2024 07:07,
1084,12.0,3813.0,email_open,2024-01-29 20:55:00,
1085,9.0,1562.0,email_open,2024-01-04 14:17:00,
1086,6.0,3147.0,web_visit,01-09-2024 09:17,tracking lost
1087,1.0,2341.0,web-visit,2024-01-17 04:39:00,unknown
1088,5.0,2650.0,form_fill,2024-01-06 17:01:00,unknown
1089,8.0,1738.0,,01-21-2024 18:49,
1090,2.0,3470.0,,11/01/2024 22:41,
1091,15.0,1718.0,web_visit,20/01/2024 20:06,Browser: Chrome
1092,2.0,3107.0,FORMFILL,26/01/2024 23:54,
1093,1.0,3443.0,web-visit,2024-01-02 18:52:00,unknown
1094,6.0,2270.0,Email Open,04/01/2024 05:51,Firefox
1095,9.0,1561.0,web-visit,2024-01-23 18:33:00,Firefox
1096,3.0,2025.0,email_click,2024-01-17 09:37:00,utm=xyz
1097,3.0,3768.0,EMAIL_CLICK,2024-01-29 23:14:00,utm=xyz
1098,6.0,2578.0,,01-23-2024 05:42,
1099,13.0,4161.0,email_open,2024-01-14 15:37:00,utm=xyz
1100,3.0,3127.0,form_fill,03/01/2024 05:44,
1101,10.0,3448.0,web_visit,2024-01-23 02:47:00,
1102,2.0,2699.0,EMAIL_CLICK,01-21-2024 18:00,utm=xyz
1103,4.0,3458.0,form_fill,2024-01-26 17:32:00,Firefox
1104,8.0,4046.0,web_visit,2024-01-07 05:43:00,
1105,5.0,4904.0,web-visit,2024-01-23 21:47:00,
1106,12.0,4281.0,form_fill,2024-01-27 01:53:00,
1107,12.0,2541.0,FORMFILL,2024-01-05 06:19:00,Firefox
1108,7.0,4980.0,email_click,22/01/2024 22:31,
1109,5.0,4023.0,,24/01/2024 19:40,
1110,8.0,1704.0,email_click,01-30-2024 08:32,utm=xyz
1111,10.0,2519.0,web-visit,2024-01-05 07:53:00,
1112,12.0,1995.0,form_fill,01-15-2024 22:53,
1113,13.0,3729.0,form_fill,01-10-2024 22:29,
1114,9.0,1042.0,email_open,22/01/2024 07:26,
1115,9.0,4003.0,EMAIL_CLICK,08/01/2024 03:13,tracking lost
1116,1.0,4290.0,Email Open,2024-01-21 06:16:00,
1117,12.0,2926.0,EMAIL_CLICK,16/01/2024 20:35,
1118,5.0,4491.0,Email Open,01-18-2024 01:00,
1119,14.0,1133.0,Email Open,2024-01-24 13:23:00,Browser: Chrome
1120,12.0,2748.0,EMAIL_CLICK,15/01/2024 12:54,
1121,1.0,1964.0,,08/01/2024 06:07,unknown
1122,14.0,1721.0,form_fill,2024-01-11 16:15:00,
1123,5.0,2836.0,form_fill,27/01/2024 03:23,
1124,7.0,1476.0,form_fill,29/01/2024 09:33,
1125,13.0,4611.0,Email Open,17/01/2024 20:45,unknown
1126,11.0,4993.0,,2024-01-20 01:58:00,Browser: Chrome
1127,12.0,2300.0,email_open,2024-01-17 10:55:00,
1128,1.0,2036.0,web-visit,11/01/2024 19:06,
1129,9.0,2982.0,FORMFILL,2024-01-03 06:44:00,Browser: Chrome
1130,5.0,3104.0,email_open,2024-01-04 07:05:00,
1131,13.0,3424.0,,2024-01-20 08:16:00,
1132,5.0,3296.0,Email Open,20/01/2024 05:28,
1133,9.0,4064.0,email_open,2024-01-21 00:49:00,tracking lost
1134,9.0,3063.0,web_visit,2024-01-05 16:21:00,Firefox
1135,2.0,1768.0,,26/01/2024 17:48,tracking lost
1136,13.0,3952.0,web_visit,01-17-2024 14:23,
1137,5.0,4492.0,FORMFILL,05/01/2024 17:39,
1138,2.0,4407.0,Email Open,2024-01-26 12:07:00,Browser: Chrome
1139,14.0,1878.0,Email Open,22/01/2024 17:40,utm=xyz
1140,5.0,3520.0,EMAIL_CLICK,2024-01-16 15:50:00,unknown
1141,14.0,1059.0,EMAIL_CLICK,01-08-2024 04:34,
1142,9.0,3591.0,email_open,2024-01-16 19:57:00,
1143,7.0,4207.0,web-visit,2024-01-24 03:40:00,
1144,3.0,1605.0,Email Open,2024-01-09 14:52:00,
1145,2.0,2452.0,web-visit,23/01/2024 15:18,
1146,2.0,4313.0,FORMFILL,01-03-2024 19:48,
1147,7.0,1742.0,FORMFILL,01-26-2024 08:19,Browser: Chrome
1148,12.0,3433.0,EMAIL_CLICK,2024-01-25 05:36:00,Browser: Chrome
1149,6.0,1673.0,Email Open,2024-01-13 15:52:00,
1150,15.0,4304.0,EMAIL_CLICK,12/01/2024 14:21,utm=xyz
1151,8.0,2644.0,form_fill,2024-01-22 13:10:00,
1152,4.0,3387.0,email_open,11/01/2024 06:27,Browser: Chrome
1153,1.0,3895.0,email_click,2024-01-16 18:44:00,Browser: Chrome
1154,13.0,4146.0,web_visit,01-05-2024 07:41,
1155,2.0,1572.0,email_click,2024-01-09 13:46:00,
1156,14.0,2218.0,EMAIL_CLICK,2024-01-13 04:52:00,
1157,10.0,1653.0,form_fill,2024-01-18 16:37:00,tracking lost
1158,5.0,4822.0,form_fill,01-21-2024 18:41,
1159,8.0,2368.0,web-visit,29/01/2024 03:40,tracking lost
1160,9.0,1966.0,Email Open,01-06-2024 13:55,
1161,9.0,1790.0,form_fill,01-19-2024 16:56,utm=xyz
1162,1.0,4386.0,EMAIL_CLICK,01-16-2024 19:45,
1163,9.0,1711.0,Email Open,01-30-2024 06:29,
1164,5.0,4076.0,FORMFILL,2024-01-27 03:01:00,utm=xyz
1165,8.0,2657.0,web-visit,2024-01-17 13:34:00,
1166,12.0,3189.0,,2024-01-25 02:40:00,utm=xyz
1167,1.0,4819.0,web_visit,01-25-2024 15:37,unknown
1168,2.0,2957.0,Email Open,15/01/2024 20:01,tracking lost
1169,10.0,4336.0,form_fill,2024-01-30 22:56:00,tracking lost
1170,4.0,1190.0,email_open,01-05-2024 06:42,
1171,15.0,1870.0,EMAIL_CLICK,01-08-2024 16:39,
1172,11.0,4922.0,form_fill,2024-01-18 00:37:00,tracking lost
1173,11.0,1898.0,web-visit,01-25-2024 17:57,Firefox
1174,8.0,4831.0,web-visit,01-06-2024 19:04,unknown
1175,2.0,3853.0,web_visit,2024-01-26 21:35:00,Browser: Chrome
1176,9.0,1107.0,,01-18-2024 10:40,tracking lost
1177,9.0,2338.0,web-visit,2024-01-01 09:49:00,utm=xyz
1178,5.0,4058.0,EMAIL_CLICK,2024-01-20 21:35:00,
1179,9.0,1879.0,EMAIL_CLICK,2024-01-07 18:26:00,Firefox
1180,2.0,4033.0,web_visit,2024-01-29 05:49:00,Firefox
1181,6.0,3258.0,,30/01/2024 17:49,Browser: Chrome
1182,5.0,3354.0,email_open,2024-01-29 11:12:00,tracking lost
1183,3.0,1159.0,FORMFILL,2024-01-06 04:47:00,utm=xyz
1184,3.0,2997.0,web_visit,2024-01-25 20:17:00,
1185,11.0,3768.0,email_open,2024-01-04 04:23:00,
1186,1.0,3219.0,web_visit,11/01/2024 05:09,
1187,3.0,3692.0,EMAIL_CLICK,01-05-2024 22:17,unknown
1188,2.0,2584.0,web_visit,01-22-2024 10:20,
1189,10.0,2957.0,FORMFILL,01-14-2024 22:18,tracking lost
1190,2.0,4371.0,EMAIL_CLICK,17/01/2024 11:44,
1191,12.0,2528.0,web_visit,28/01/2024 22:40,unknown
1192,2.0,4392.0,,01-12-2024 10:14,utm=xyz
1193,9.0,3708.0,email_click,19/01/2024 08:38,
1194,11.0,3065.0,,29/01/2024 02:16,utm=xyz
1195,6.0,3194.0,email_open,2024-01-14 15:05:00,
1196,6.0,2364.0,web_visit,22/01/2024 04:25,Browser: Chrome
1197,5.0,1009.0,web_visit,26/01/2024 06:24,
1198,5.0,1438.0,web_visit,01-17-2024 03:32,Browser: Chrome
1199,5.0,3148.0,form_fill,2024-01-22 17:00:00,
1200,13.0,3573.0,FORMFILL,01-16-2024 17:38,
1201,8.0,3850.0,web-visit,20/01/2024 19:38,
1202,9.0,3282.0,web_visit,29/01/2024 17:09,
1203,11.0,3928.0,EMAIL_CLICK,03/01/2024 21:17,Browser: Chrome
1204,12.0,2221.0,,27/01/2024 02:34,utm=xyz
1205,6.0,3937.0,email_open,01-15-2024 15:21,
1206,12.0,2199.0,email_click,22/01/2024 07:37,
1207,14.0,2021.0,EMAIL_CLICK,2024-01-19 21:54:00,Firefox
1208,10.0,1910.0,web_visit,2024-01-06 19:00:00,
1209,7.0,3519.0,email_open,01-30-2024 06:07,
1210,13.0,4551.0,email_click,01/01/2024 17:49,utm=xyz
1211,10.0,2904.0,email_click,01-04-2024 02:22,
1212,13.0,2943.0,EMAIL_CLICK,01-08-2024 04:40,
1213,7.0,2353.0,form_fill,2024-01-04 22:27:00,unknown
1214,10.0,3779.0,Email Open,21/01/2024 21:13,tracking lost
1215,7.0,1573.0,email_open,01-12-2024 13:49,
1216,9.0,4471.0,web_visit,2024-01-11 03:50:00,Firefox
1217,2.0,2838.0,form_fill,06/01/2024 22:15,
1218,8.0,2183.0,Email Open,14/01/2024 20:46,tracking lost
1219,5.0,1287.0,email_click,01-27-2024 14:27,
1220,7.0,2550.0,Email Open,01-19-2024 09:04,Browser: Chrome
1221,7.0,4228.0,FORMFILL,01-13-2024 21:12,tracking lost
1222,12.0,1296.0,FORMFILL,02/01/2024 07:27,Browser: Chrome
1223,15.0,3860.0,form_fill,01-28-2024 08:18,Browser: Chrome
1224,9.0,1631.0,email_open,01-09-2024 00:59,utm=xyz
1225,15.0,1341.0,EMAIL_CLICK,01-14-2024 22:27,
1226,14.0,1754.0,,2024-01-24 08:25:00,Browser: Chrome
1227,15.0,2056.0,email_open,2024-01-26 08:13:00,unknown
1228,5.0,2870.0,FORMFILL,21/01/2024 02:52,
1229,9.0,1024.0,web_visit,01-24-2024 10:11,
1230,5.0,2109.0,email_open,2024-01-17 14:38:00,
1231,11.0,2708.0,FORMFILL,20/01/2024 21:03,
1232,5.0,1430.0,form_fill,05/01/2024 16:49,
1233,3.0,1797.0,web_visit,01-15-2024 18:25,tracking lost
1234,7.0,4272.0,web_visit,2024-01-10 11:09:00,
1235,3.0,2588.0,EMAIL_CLICK,01-10-2024 23:44,
1236,14.0,4170.0,Email Open,20/01/2024 02:46,Firefox
1237,14.0,1592.0,EMAIL_CLICK,06/01/2024 10:59,
1238,4.0,3019.0,Email Open,01-19-2024 08:15,
1239,14.0,3956.0,email_open,2024-01-12 04:17:00,Browser: Chrome
1240,1.0,2514.0,web_visit,2024-01-21 06:09:00,Firefox
1241,12.0,2143.0,email_click,03/01/2024 04:29,Firefox
1242,3.0,4796.0,web-visit,2024-01-03 05:11:00,Firefox
1243,11.0,2081.0,web_visit,2024-01-10 21:55:00,
1244,12.0,2404.0,,28/01/2024 02:49,utm=xyz
1245,8.0,2076.0,web-visit,01-05-2024 12:37,tracking lost
1246,10.0,4273.0,,01-24-2024 22:02,utm=xyz
1247,1.0,1343.0,email_open,01-11-2024 04:35,utm=xyz
1248,11.0,4666.0,web_visit,01-26-2024 11:03,utm=xyz
1249,4.0,3024.0,FORMFILL,01-06-2024 20:52,
1250,14.0,2758.0,form_fill,19/01/2024 05:15,
1251,12.0,4242.0,email_open,01-26-2024 21:01,
1252,7.0,1155.0,email_click,2024-01-15 13:20:00,utm=xyz
1253,5.0,4352.0,,16/01/2024 01:05,
1254,5.0,4879.0,form_fill,06/01/2024 12:54,unknown
1255,14.0,1314.0,form_fill,2024-01-21 11:34:00,tracking lost
1256,12.0,1222.0,,2024-01-18 00:15:00,Firefox
1257,4.0,4853.0,EMAIL_CLICK,24/01/2024 20:38,tracking lost
1258,6.0,1261.0,email_open,2024-01-27 03:05:00,
1259,1.0,3611.0,email_open,23/01/2024 04:05,utm=xyz
1260,6.0,3094.0,,24/01/2024 11:13,
1261,3.0,1520.0,web_visit,2024-01-03 03:53:00,Browser: Chrome
1262,13.0,3046.0,email_open,27/01/2024 11:18,Browser: Chrome
1263,15.0,4550.0,email_click,2024-01-17 06:17:00,unknown
1264,8.0,4242.0,email_open,08/01/2024 12:59,Firefox
1265,3.0,2201.0,,05/01/2024 12:00,Firefox
1266,4.0,2014.0,web-visit,2024-01-10 16:39:00,utm=xyz
1267,1.0,2998.0,email_click,2024-01-13 02:22:00,Browser: Chrome
1268,8.0,2912.0,FORMFILL,20/01/2024 12:08,tracking lost
1269,12.0,3167.0,email_open,01-18-2024 09:18,
1270,9.0,1832.0,web-visit,01-14-2024 00:25,tracking lost
1271,3.0,1842.0,Email Open,2024-01-06 08:35:00,Firefox
1272,9.0,3230.0,form_fill,01-17-2024 22:50,
1273,4.0,4722.0,Email Open,01-13-2024 01:37,tracking lost
1274,12.0,3788.0,web_visit,13/01/2024 11:24,
1275,14.0,1963.0,web-visit,2024-01-08 06:41:00,Browser: Chrome
1276,14.0,2196.0,email_click,2024-01-11 12:55:00,unknown
1277,4.0,2228.0,email_click,01-19-2024 01:05,unknown
1278,13.0,4296.0,email_click,2024-01-04 19:36:00,
1279,10.0,2001.0,Email Open,16/01/2024 10:27,
1280,9.0,4524.0,web_visit,01-06-2024 06:03,
1281,9.0,3198.0,email_open,01-09-2024 14:26,Firefox
1282,11.0,4019.0,,30/01/2024 03:24,utm=xyz
1283,9.0,1694.0,Email Open,01-29-2024 10:04,
1284,11.0,3319.0,email_open,01-02-2024 06:48,
1285,4.0,3681.0,email_open,01-01-2024 11:22,
1286,11.0,4724.0,form_fill,09/01/2024 12:46,unknown
1287,7.0,2506.0,Email Open,01-05-2024 16:30,
1288,5.0,1806.0,email_open,2024-01-04 04:10:00,
1289,14.0,4464.0,FORMFILL,01-18-2024 21:05,
1290,2.0,2508.0,email_click,2024-01-12 22:34:00,
1291,1.0,1162.0,FORMFILL,28/01/2024 16:36,tracking lost
1292,6.0,3412.0,web-visit,01-03-2024 20:58,Firefox
1293,14.0,4069.0,email_open,2024-01-26 19:33:00,utm=xyz
1294,13.0,1790.0,FORMFILL,2024-01-14 08:01:00,
1295,11.0,1446.0,Email Open,18/01/2024 19:58,
1296,12.0,3472.0,email_click,2024-01-23 12:00:00,unknown
1297,2.0,4411.0,Email Open,01-09-2024 23:51,utm=xyz
1298,9.0,1239.0,FORMFILL,12/01/2024 20:46,utm=xyz
1299,1.0,1575.0,FORMFILL,23/01/2024 08:39,Firefox
1300,12.0,3376.0,email_open,2024-01-28 10:54:00,unknown
1301,4.0,3737.0,form_fill,2024-01-14 03:24:00,Browser: Chrome
1302,4.0,3898.0,web-visit,01-21-2024 23:58,Firefox
1303,10.0,4366.0,EMAIL_CLICK,2024-01-06 10:57:00,
1304,14.0,1489.0,Email Open,2024-01-18 06:42:00,
1305,2.0,4620.0,email_click,2024-01-05 13:42:00,Browser: Chrome
1306,1.0,2822.0,form_fill,2024-01-15 21:30:00,
1307,14.0,3980.0,email_open,01-13-2024 23:10,
1308,10.0,4773.0,email_click,2024-01-24 08:29:00,
1309,13.0,4486.0,EMAIL_CLICK,01-02-2024 12:49,
1310,8.0,3037.0,form_fill,2024-01-18 19:55:00,Browser: Chrome
1311,15.0,1569.0,email_open,11/01/2024 16:00,
1312,12.0,4157.0,web-visit,2024-01-15 03:19:00,
1313,4.0,1675.0,FORMFILL,01/01/2024 01:24,
1314,10.0,4741.0,Email Open,28/01/2024 08:53,Browser: Chrome
1315,1.0,2322.0,Email Open,01-20-2024 15:07,Firefox
1316,10.0,1797.0,email_open,01-03-2024 04:59,
1317,1.0,2091.0,EMAIL_CLICK,2024-01-04 09:16:00,
1318,5.0,3931.0,,25/01/2024 12:56,
1319,7.0,1594.0,Email Open,25/01/2024 06:04,
1320,2.0,3791.0,web-visit,2024-01-26 04:56:00,
1321,4.0,1717.0,,14/01/2024 04:30,unknown
1322,5.0,2498.0,,01-24-2024 19:41,Firefox
1323,4.0,2429.0,email_open,2024-01-03 02:26:00,unknown
1324,4.0,3316.0,EMAIL_CLICK,2024-01-15 21:30:00,unknown
1325,15.0,1310.0,FORMFILL,2024-01-28 14:25:00,Browser: Chrome
1326,6.0,2210.0,web-visit,13/01/2024 10:31,
1327,15.0,1110.0,EMAIL_CLICK,01-12-2024 02:54,Firefox
1328,9.0,1421.0,email_open,2024-01-10 06:48:00,unknown
1329,9.0,2542.0,FORMFILL,01-27-2024 12:49,utm=xyz
1330,14.0,1415.0,,01-21-2024 02:20,utm=xyz
1331,10.0,4776.0,email_open,2024-01-10 12:05:00,tracking lost
1332,7.0,4023.0,email_click,01-19-2024 21:16,unknown
1333,14.0,2869.0,web-visit,2024-01-17 21:58:00,Firefox
1334,12.0,1629.0,FORMFILL,04/01/2024 21:35,
1335,8.0,3070.0,EMAIL_CLICK,01-11-2024 04:21,Firefox
1336,11.0,4311.0,web_visit,29/01/2024 13:26,tracking lost
1337,1.0,3472.0,email_click,2024-01-22 18:33:00,utm=xyz
1338,8.0,1978.0,email_open,01-28-2024 15:28,Browser: Chrome
1339,1.0,4809.0,FORMFILL,2024-01-11 09:11:00,tracking lost
1340,6.0,3060.0,EMAIL_CLICK,2024-01-22 12:39:00,
1341,1.0,2908.0,email_click,01-16-2024 04:38,Browser: Chrome
1342,15.0,2714.0,form_fill,01-18-2024 21:15,Firefox
1343,9.0,4721.0,email_click,30/01/2024 04:32,Browser: Chrome
1344,8.0,2728.0,web-visit,01-14-2024 12:06,unknown
1345,8.0,4908.0,Email Open,01-29-2024 07:57,
1346,5.0,2897.0,web-visit,2024-01-27 08:53:00,
1347,11.0,2883.0,EMAIL_CLICK,01-07-2024 18:26,
1348,6.0,4843.0,FORMFILL,03/01/2024 05:17,Browser: Chrome
1349,7.0,2645.0,web-visit,01-14-2024 08:20,
1350,6.0,2104.0,EMAIL_CLICK,2024-01-19 05:15:00,utm=xyz
1351,3.0,1019.0,email_click,01-23-2024 07:11,
1352,4.0,4789.0,email_click,30/01/2024 06:52,
1353,7.0,3249.0,email_open,22/01/2024 11:13,utm=xyz
1354,6.0,1052.0,Email Open,01-27-2024 05:29,
1355,1.0,2438.0,web_visit,2024-01-11 08:46:00,
1356,4.0,3912.0,email_open,2024-01-17 09:23:00,
1357,11.0,1446.0,form_fill,25/01/2024 11:22,Firefox
1358,3.0,4498.0,Email Open,01-03-2024 13:51,
1359,8.0,4385.0,Email Open,25/01/2024 12:02,unknown
1360,15.0,3751.0,web-visit,01-12-2024 15:55,
1361,4.0,1674.0,email_click,01-13-2024 11:20,tracking lost
1362,12.0,3486.0,FORMFILL,2024-01-13 05:15:00,unknown
1363,4.0,4260.0,EMAIL_CLICK,2024-01-10 00:11:00,tracking lost
1364,7.0,2955.0,form_fill,2024-01-20 11:56:00,Firefox
1365,6.0,4156.0,web_visit,01-15-2024 20:05,
1366,14.0,3624.0,web_visit,2024-01-23 00:47:00,Firefox
1367,3.0,2443.0,web_visit,01-02-2024 20:17,Firefox
1368,5.0,4146.0,web-visit,05/01/2024 16:47,unknown
1369,13.0,1632.0,EMAIL_CLICK,01-07-2024 07:57,
1370,1.0,4871.0,web_visit,30/01/2024 23:45,
1371,10.0,4773.0,,22/01/2024 09:53,utm=xyz
1372,6.0,2379.0,FORMFILL,01-02-2024 15:51,
1373,11.0,1457.0,email_open,01-15-2024 20:27,
1374,4.0,1592.0,web_visit,21/01/2024 03:52,
1375,3.0,3183.0,email_open,12/01/2024 18:28,
1376,15.0,2608.0,email_click,30/01/2024 06:40,
1377,15.0,1941.0,web_visit,01-29-2024 20:24,tracking lost
1378,14.0,1761.0,FORMFILL,2024-01-29 11:43:00,
1379,12.0,3400.0,Email Open,01-25-2024 03:06,
1380,7.0,3489.0,FORMFILL,2024-01-21 04:30:00,utm=xyz
1381,8.0,3566.0,FORMFILL,01-15-2024 14:08,unknown
1382,15.0,2800.0,Email Open,01-23-2024 10:46,tracking lost
1383,12.0,2194.0,email_click,2024-01-09 23:27:00,
1384,1.0,4974.0,email_click,04/01/2024 08:05,
1385,2.0,4880.0,EMAIL_CLICK,01-06-2024 15:56,utm=xyz
1386,6.0,4041.0,FORMFILL,2024-01-14 04:35:00,unknown
1387,5.0,3732.0,form_fill,18/01/2024 18:53,utm=xyz
1388,6.0,4010.0,,01-23-2024 12:41,unknown
1389,2.0,1107.0,email_click,01-19-2024 06:33,tracking lost
1390,4.0,2036.0,email_open,01-27-2024 16:30,
1391,13.0,1516.0,Email Open,17/01/2024 03:44,
1392,2.0,1347.0,EMAIL_CLICK,01-25-2024 23:33,
1393,13.0,2576.0,web_visit,2024-01-28 11:57:00,
1394,15.0,2456.0,Email Open,2024-01-18 09:17:00,utm=xyz
1395,13.0,2865.0,Email Open,01-03-2024 02:59,Firefox
1396,3.0,3273.0,FORMFILL,15/01/2024 21:04,unknown
1397,6.0,4582.0,,01-05-2024 02:43,
1398,9.0,2907.0,web_visit,01-05-2024 13:04,
1399,13.0,1778.0,form_fill,03/01/2024 20:38,
1400,4.0,2079.0,form_fill,2024-01-18 10:13:00,Browser: Chrome
1401,5.0,1983.0,FORMFILL,01-16-2024 02:55,
1402,12.0,4436.0,Email Open,27/01/2024 13:50,Browser: Chrome
1403,15.0,3904.0,form_fill,2024-01-12 19:17:00,tracking lost
1404,1.0,4825.0,EMAIL_CLICK,06/01/2024 11:37,Firefox
1405,3.0,1781.0,form_fill,20/01/2024 15:12,utm=xyz
1406,9.0,2439.0,email_open,14/01/2024 06:53,tracking lost
1407,11.0,3879.0,,06/01/2024 13:28,tracking lost
1408,2.0,3625.0,EMAIL_CLICK,2024-01-10 22:19:00,Firefox
1409,12.0,3589.0,,30/01/2024 01:13,
1410,2.0,4097.0,FORMFILL,2024-01-28 05:56:00,
1411,13.0,1380.0,Email Open,03/01/2024 23:02,unknown
1412,7.0,2023.0,web_visit,2024-01-19 17:08:00,
1413,15.0,3910.0,web_visit,2024-01-21 01:43:00,
1414,2.0,2340.0,,29/01/2024 23:05,
1415,4.0,1219.0,email_open,01-11-2024 11:26,Browser: Chrome
1416,9.0,3372.0,web_visit,18/01/2024 15:56,
1417,3.0,1853.0,email_click,07/01/2024 18:11,unknown
1418,12.0,2728.0,Email Open,2024-01-06 06:58:00,
1419,10.0,1763.0,form_fill,22/01/2024 04:25,tracking lost
1420,1.0,4543.0,Email Open,01-22-2024 06:05,tracking lost
1421,12.0,1806.0,,28/01/2024 14:17,Browser: Chrome
1422,13.0,1812.0,web-visit,2024-01-26 09:49:00,
1423,14.0,3229.0,Email Open,2024-01-09 19:55:00,utm=xyz
1424,11.0,3873.0,web-visit,2024-01-02 15:18:00,
1425,14.0,3293.0,,01-10-2024 05:47,Firefox
1426,11.0,4111.0,email_click,29/01/2024 09:44,utm=xyz
1427,12.0,1201.0,FORMFILL,07/01/2024 20:05,
1428,14.0,4742.0,form_fill,2024-01-01 10:08:00,
1429,2.0,1335.0,FORMFILL,2024-01-02 23:11:00,unknown
1430,12.0,2786.0,email_click,07/01/2024 11:42,
1431,2.0,1416.0,Email Open,2024-01-26 11:36:00,Browser: Chrome
1432,7.0,4551.0,web_visit,05/01/2024 02:17,unknown
1433,4.0,4004.0,web-visit,01-29-2024 01:13,tracking lost
1434,5.0,1610.0,EMAIL_CLICK,27/01/2024 03:31,Firefox
1435,2.0,1117.0,web-visit,20/01/2024 21:05,
1436,1.0,3571.0,EMAIL_CLICK,04/01/2024 02:16,utm=xyz
1437,13.0,1587.0,Email Open,01-14-2024 18:50,tracking lost
1438,13.0,2553.0,Email Open,01-30-2024 10:10,Browser: Chrome
1439,8.0,4404.0,EMAIL_CLICK,15/01/2024 18:54,
1440,13.0,1603.0,email_open,01-30-2024 13:03,Browser: Chrome
1441,10.0,3708.0,web-visit,2024-01-08 02:58:00,Browser: Chrome
1442,5.0,1599.0,form_fill,01-11-2024 05:54,
1443,11.0,3377.0,web-visit,2024-01-24 04:47:00,Firefox
1444,13.0,4698.0,EMAIL_CLICK,2024-01-01 19:02:00,
1445,14.0,3522.0,email_open,29/01/2024 15:06,Browser: Chrome
1446,6.0,3198.0,Email Open,2024-01-11 20:47:00,Browser: Chrome
1447,12.0,4938.0,EMAIL_CLICK,01-22-2024 02:56,Firefox
1448,9.0,2149.0,Email Open,23/01/2024 08:52,utm=xyz
1449,12.0,4745.0,email_click,2024-01-22 13:37:00,
1450,1.0,2442.0,web_visit,25/01/2024 01:27,
1451,9.0,3002.0,email_click,22/01/2024 00:01,Browser: Chrome
1452,5.0,4883.0,email_click,01-03-2024 18:15,utm=xyz
1453,12.0,4916.0,FORMFILL,01-21-2024 14:48,tracking lost
1454,14.0,3978.0,FORMFILL,01-30-2024 09:20,tracking lost
1455,10.0,2639.0,web_visit,2024-01-11 11:20:00,unknown
1456,2.0,2440.0,form_fill,2024-01-15 02:27:00,
1457,12.0,3779.0,,01-08-2024 14:05,tracking lost
1458,12.0,1923.0,email_open,01-18-2024 07:01,
1459,15.0,1052.0,web_visit,01-12-2024 10:58,tracking lost
1460,5.0,3314.0,FORMFILL,2024-01-08 23:10:00,
1461,11.0,2552.0,email_click,2024-01-14 00:00:00,
1462,6.0,2337.0,email_open,30/01/2024 14:33,utm=xyz
1463,12.0,2677.0,form_fill,22/01/2024 03:02,Browser: Chrome
1464,5.0,3111.0,EMAIL_CLICK,2024-01-10 02:04:00,
1465,9.0,4515.0,EMAIL_CLICK,01-13-2024 05:13,tracking lost
1466,4.0,2727.0,EMAIL_CLICK,2024-01-27 19:26:00,
1467,6.0,1886.0,,07/01/2024 08:07,
1468,2.0,1024.0,Email Open,01-07-2024 14:08,Browser: Chrome
1469,14.0,1039.0,,01-12-2024 03:20,
1470,10.0,3434.0,web_visit,19/01/2024 10:22,Browser: Chrome
1471,4.0,2951.0,,01-28-2024 08:45,
1472,7.0,1456.0,Email Open,01-18-2024 23:50,utm=xyz
1473,1.0,3548.0,web-visit,01-15-2024 01:53,tracking lost
1474,9.0,1564.0,Email Open,08/01/2024 07:24,
1475,2.0,2231.0,form_fill,01/01/2024 10:30,utm=xyz
1476,15.0,3031.0,FORMFILL,2024-01-14 02:32:00,tracking lost
1477,4.0,3399.0,EMAIL_CLICK,01-06-2024 00:41,
1478,10.0,1858.0,form_fill,30/01/2024 14:43,unknown
1479,10.0,4442.0,Email Open,24/01/2024 09:21,Firefox
1480,14.0,3810.0,web_visit,08/01/2024 11:39,
1481,12.0,4152.0,EMAIL_CLICK,01-11-2024 03:43,tracking lost
1482,2.0,2279.0,FORMFILL,01-28-2024 15:47,unknown
1483,4.0,1420.0,EMAIL_CLICK,27/01/2024 03:57,unknown
1484,6.0,1560.0,,2024-01-19 09:39:00,
1485,3.0,4722.0,,01-23-2024 10:38,unknown
1486,15.0,3619.0,form_fill,08/01/2024 13:05,utm=xyz
1487,1.0,4816.0,form_fill,03/01/2024 05:18,Firefox
1488,4.0,2654.0,,2024-01-03 05:46:00,
1489,4.0,3394.0,form_fill,30/01/2024 05:15,Firefox
1490,9.0,3443.0,email_click,23/01/2024 09:12,unknown
1491,4.0,1611.0,email_click,01-12-2024 20:37,
1492,15.0,4055.0,EMAIL_CLICK,01-04-2024 14:08,tracking lost
1493,10.0,2826.0,email_click,2024-01-21 20:03:00,unknown
1494,13.0,1284.0,email_click,2024-01-12 18:25:00,
1495,12.0,3783.0,email_open,05/01/2024 10:52,
1496,14.0,1737.0,form_fill,01-05-2024 06:19,Firefox
1497,1.0,4933.0,Email Open,2024-01-07 17:34:00,
1498,8.0,3569.0,web-visit,01/01/2024 16:09,
1499,3.0,2894.0,email_click,2024-01-06 13:09:00,
1500,4.0,4338.0,EMAIL_CLICK,01-09-2024 04:36,Browser: Chrome
1501,4.0,1680.0,FORMFILL,23/01/2024 21:18,
1502,7.0,4650.0,FORMFILL,2024-01-17 20:48:00,Browser: Chrome
1503,14.0,4355.0,Email Open,2024-01-04 11:12:00,tracking lost
1504,12.0,2800.0,web-visit,01-29-2024 08:56,tracking lost
1505,3.0,2366.0,FORMFILL,05/01/2024 07:24,unknown
1506,12.0,2535.0,form_fill,2024-01-20 04:36:00,tracking lost
1507,1.0,2576.0,,01-28-2024 05:36,tracking lost
1508,7.0,4056.0,web-visit,01-10-2024 09:00,utm=xyz
1509,6.0,1093.0,email_open,2024-01-10 07:18:00,
1510,1.0,4481.0,email_click,01-21-2024 22:53,
1511,1.0,2976.0,web-visit,01-06-2024 07:49,unknown
1512,2.0,1590.0,form_fill,04/01/2024 20:12,
1513,11.0,1763.0,web-visit,01-30-2024 22:04,tracking lost
1514,2.0,3632.0,form_fill,2024-01-25 00:44:00,Browser: Chrome
1515,7.0,3025.0,email_click,01-03-2024 09:45,tracking lost
1516,11.0,2741.0,Email Open,01-08-2024 20:38,unknown
1517,13.0,4151.0,email_click,30/01/2024 12:56,Browser: Chrome
1518,7.0,3328.0,form_fill,01-07-2024 12:30,utm=xyz
1519,12.0,1512.0,web_visit,01-30-2024 13:15,
1520,15.0,2209.0,web_visit,2024-01-25 17:09:00,Firefox
1521,5.0,1154.0,form_fill,2024-01-13 21:00:00,
1522,3.0,2520.0,EMAIL_CLICK,2024-01-02 00:26:00,
1523,5.0,3345.0,email_click,2024-01-02 13:55:00,utm=xyz
1524,15.0,1792.0,EMAIL_CLICK,01-16-2024 06:35,utm=xyz
1525,12.0,1398.0,Email Open,01-21-2024 23:57,unknown
1526,12.0,2740.0,email_click,01-03-2024 04:46,
1527,11.0,4322.0,Email Open,2024-01-28 17:29:00,Browser: Chrome
1528,10.0,2615.0,web-visit,23/01/2024 16:08,
1529,14.0,3447.0,form_fill,01-20-2024 11:54,
1530,7.0,2818.0,web-visit,2024-01-06 12:48:00,Firefox
1531,2.0,1275.0,web_visit,04/01/2024 01:25,
1532,12.0,1779.0,FORMFILL,01-14-2024 04:11,unknown
1533,9.0,2888.0,web_visit,13/01/2024 18:03,Browser: Chrome
1534,13.0,1899.0,web-visit,30/01/2024 15:33,
1535,9.0,3697.0,email_click,2024-01-23 07:45:00,unknown
1536,15.0,4426.0,,01-20-2024 09:38,Firefox
1537,3.0,4895.0,web_visit,2024-01-29 09:22:00,
1538,13.0,4457.0,form_fill,30/01/2024 01:24,utm=xyz
1539,13.0,1692.0,email_open,2024-01-14 02:36:00,unknown
1540,10.0,3300.0,,2024-01-08 05:34:00,
1541,5.0,4660.0,email_open,16/01/2024 12:56,unknown
1542,3.0,4438.0,form_fill,22/01/2024 11:54,Firefox
1543,4.0,2498.0,email_open,01-28-2024 00:38,utm=xyz
1544,7.0,1685.0,,28/01/2024 12:23,
1545,10.0,4444.0,email_open,28/01/2024 16:19,
1546,7.0,3153.0,web_visit,01-15-2024 18:01,Firefox
1547,14.0,1753.0,email_click,30/01/2024 12:14,tracking lost
1548,3.0,3932.0,Email Open,01-05-2024 07:11,Firefox
1549,13.0,1397.0,,09/01/2024 11:32,
1550,7.0,1827.0,FORMFILL,2024-01-06 09:47:00,utm=xyz
1551,3.0,3997.0,web-visit,05/01/2024 21:12,
1552,13.0,3998.0,,08/01/2024 03:57,Firefox
1553,13.0,2211.0,Email Open,06/01/2024 23:03,
1554,5.0,2186.0,Email Open,03/01/2024 18:35,tracking lost
1555,7.0,4950.0,email_click,05/01/2024 15:46,utm=xyz
1556,12.0,2593.0,web-visit,2024-01-07 09:44:00,Browser: Chrome
1557,8.0,4775.0,form_fill,2024-01-11 09:51:00,Firefox
1558,3.0,1276.0,,01-12-2024 00:14,
1559,1.0,2154.0,email_open,01-10-2024 11:23,
1560,12.0,3347.0,EMAIL_CLICK,2024-01-08 11:21:00,Firefox
1561,1.0,2056.0,web-visit,2024-01-20 20:09:00,
1562,5.0,4603.0,FORMFILL,16/01/2024 08:53,
1563,1.0,1952.0,EMAIL_CLICK,25/01/2024 19:12,
1564,14.0,4616.0,,2024-01-04 10:44:00,
1565,4.0,3306.0,email_click,01-11-2024 17:09,
1566,4.0,3484.0,web_visit,28/01/2024 07:46,
1567,7.0,3089.0,EMAIL_CLICK,01-19-2024 18:07,unknown
1568,10.0,1930.0,email_click,2024-01-13 07:30:00,Firefox
1569,13.0,1667.0,web-visit,17/01/2024 05:12,tracking lost
1570,5.0,1627.0,web_visit,06/01/2024 15:35,tracking lost
1571,7.0,4457.0,Email Open,2024-01-03 04:44:00,
1572,15.0,4028.0,email_click,01-28-2024 08:14,utm=xyz
1573,5.0,2369.0,web-visit,2024-01-22 03:55:00,unknown
1574,9.0,1976.0,Email Open,2024-01-01 12:46:00,
1575,14.0,2959.0,web_visit,23/01/2024 11:43,unknown
1576,3.0,2353.0,form_fill,01-28-2024 20:13,
1577,5.0,4606.0,Email Open,01-08-2024 21:30,
1578,10.0,4668.0,Email Open,2024-01-01 02:20:00,unknown
1579,10.0,4169.0,email_click,01-03-2024 11:26,Browser: Chrome
1580,1.0,2124.0,FORMFILL,2024-01-14 02:54:00,
1581,2.0,3418.0,form_fill,24/01/2024 03:10,Browser: Chrome
1582,10.0,2122.0,email_click,24/01/2024 07:40,Browser: Chrome
1583,9.0,2622.0,Email Open,22/01/2024 00:03,
1584,5.0,3758.0,form_fill,2024-01-19 16:51:00,
1585,5.0,4889.0,EMAIL_CLICK,28/01/2024 23:09,
1586,12.0,4996.0,,04/01/2024 04:05,tracking lost
1587,8.0,4051.0,web-visit,27/01/2024 10:43,
1588,4.0,2457.0,FORMFILL,08/01/2024 01:11,tracking lost
1589,13.0,2235.0,,2024-01-03 13:47:00,Browser: Chrome
1590,7.0,3372.0,email_click,22/01/2024 10:13,
1591,10.0,4366.0,web-visit,01-10-2024 22:43,
1592,9.0,2606.0,form_fill,22/01/2024 07:01,
1593,3.0,3481.0,form_fill,2024-01-17 13:39:00,
1594,15.0,2669.0,email_open,01-03-2024 17:47,utm=xyz
1595,14.0,2233.0,email_open,01-10-2024 16:28,
1596,10.0,2928.0,form_fill,01/01/2024 14:23,
1597,3.0,2093.0,,01-25-2024 02:57,Firefox
1598,6.0,1929.0,email_open,02/01/2024 14:14,
1599,2.0,2041.0,web_visit,01-26-2024 22:53,
1600,13.0,2876.0,web_visit,01-23-2024 14:55,
1601,8.0,3547.0,email_click,2024-01-29 12:53:00,utm=xyz
1602,7.0,4032.0,FORMFILL,22/01/2024 05:54,unknown
1603,1.0,4450.0,form_fill,01-17-2024 05:08,tracking lost
1604,11.0,4766.0,FORMFILL,2024-01-10 08:28:00,unknown
1605,1.0,4266.0,,07/01/2024 10:34,
1606,3.0,4395.0,email_open,23/01/2024 02:16,unknown
1607,2.0,4387.0,email_open,09/01/2024 23:38,utm=xyz
1608,1.0,4546.0,web-visit,2024-01-18 20:49:00,utm=xyz
1609,12.0,3767.0,FORMFILL,2024-01-10 08:04:00,tracking lost
1610,13.0,1861.0,EMAIL_CLICK,14/01/2024 13:59,unknown
1611,10.0,1447.0,EMAIL_CLICK,09/01/2024 05:55,Browser: Chrome
1612,1.0,2576.0,Email Open,2024-01-05 13:57:00,Browser: Chrome
1613,3.0,3176.0,form_fill,13/01/2024 14:38,
1614,7.0,2005.0,email_click,01-13-2024 21:22,
1615,9.0,3062.0,EMAIL_CLICK,01-09-2024 10:29,utm=xyz
1616,14.0,4925.0,EMAIL_CLICK,01-16-2024 21:05,utm=xyz
1617,11.0,4201.0,web-visit,2024-01-17 13:29:00,
1618,9.0,2675.0,,30/01/2024 00:17,
1619,13.0,3195.0,email_click,02/01/2024 18:49,unknown
1620,14.0,3215.0,web-visit,2024-01-16 23:22:00,
1621,5.0,1119.0,email_open,2024-01-26 23:14:00,
1622,14.0,2871.0,,2024-01-20 11:57:00,
1623,11.0,3802.0,email_open,11/01/2024 16:05,
1624,14.0,3919.0,,2024-01-27 02:00:00,unknown
1625,3.0,4035.0,EMAIL_CLICK,11/01/2024 22:19,
1626,15.0,3832.0,Email Open,24/01/2024 20:11,
1627,13.0,2977.0,Email Open,2024-01-10 06:35:00,
1628,10.0,2803.0,email_click,01-19-2024 14:21,utm=xyz
1629,8.0,3838.0,email_click,2024-01-27 06:58:00,Browser: Chrome
1630,8.0,3061.0,form_fill,2024-01-07 05:41:00,Firefox
1631,14.0,4215.0,web_visit,19/01/2024 13:53,
1632,11.0,4656.0,FORMFILL,01-17-2024 05:53,Browser: Chrome
1633,12.0,2420.0,web_visit,2024-01-22 01:53:00,unknown
1634,5.0,4787.0,,28/01/2024 06:54,Firefox
1635,5.0,1833.0,FORMFILL,01-11-2024 13:27,tracking lost
1636,11.0,2392.0,web-visit,2024-01-08 20:39:00,
1637,14.0,4724.0,email_open,2024-01-09 20:59:00,utm=xyz
1638,15.0,1986.0,email_click,2024-01-25 04:37:00,
1639,12.0,2870.0,,01-05-2024 02:24,
1640,11.0,4425.0,web-visit,01-05-2024 18:46,utm=xyz
1641,3.0,3584.0,email_click,01/01/2024 05:58,unknown
1642,10.0,2380.0,EMAIL_CLICK,01-06-2024 15:46,
1643,5.0,2109.0,,2024-01-25 19:34:00,Firefox
1644,1.0,3989.0,Email Open,2024-01-27 15:05:00,Browser: Chrome
1645,3.0,4759.0,form_fill,20/01/2024 20:20,
1646,10.0,1125.0,email_open,2024-01-24 03:30:00,
1647,1.0,1321.0,web-visit,17/01/2024 01:30,
1648,2.0,1269.0,email_click,01-08-2024 08:40,tracking lost
1649,6.0,1321.0,email_open,01-23-2024 22:53,Browser: Chrome
1650,7.0,1090.0,EMAIL_CLICK,2024-01-23 21:41:00,tracking lost
1651,14.0,1232.0,web_visit,02/01/2024 19:14,
1652,6.0,2118.0,EMAIL_CLICK,01-20-2024 06:43,
1653,15.0,4781.0,email_open,2024-01-18 22:14:00,
1654,12.0,3154.0,web-visit,2024-01-16 12:17:00,tracking lost
1655,3.0,3988.0,FORMFILL,01-07-2024 12:13,unknown
1656,7.0,2437.0,email_open,01-21-2024 01:53,Firefox
1657,4.0,4568.0,web_visit,30/01/2024 01:01,
1658,6.0,4554.0,Email Open,20/01/2024 17:10,tracking lost
1659,5.0,4486.0,EMAIL_CLICK,2024-01-13 00:03:00,
1660,7.0,3923.0,,01-21-2024 04:43,
1661,15.0,1357.0,web-visit,2024-01-02 12:11:00,
1662,15.0,1876.0,web-visit,22/01/2024 11:46,
1663,8.0,1178.0,email_click,2024-01-07 00:24:00,unknown
1664,6.0,3604.0,,2024-01-26 14:51:00,Browser: Chrome
1665,3.0,3087.0,,2024-01-24 01:58:00,Browser: Chrome
1666,4.0,2610.0,email_click,01-13-2024 12:10,Firefox
1667,1.0,2813.0,EMAIL_CLICK,01-04-2024 03:36,
1668,11.0,1595.0,web-visit,01-27-2024 22:30,
1669,7.0,2680.0,Email Open,13/01/2024 20:36,
1670,11.0,2311.0,Email Open,01-24-2024 05:55,
1671,8.0,3731.0,,27/01/2024 16:23,
1672,5.0,3485.0,email_click,16/01/2024 16:55,Browser: Chrome
1673,5.0,3771.0,email_open,01-10-2024 21:40,Browser: Chrome
1674,11.0,2476.0,email_open,2024-01-28 12:41:00,Browser: Chrome
1675,13.0,2751.0,email_open,2024-01-25 18:34:00,utm=xyz
1676,11.0,2194.0,email_open,08/01/2024 04:20,
1677,1.0,3161.0,form_fill,01-22-2024 12:11,unknown
1678,15.0,4640.0,,27/01/2024 21:00,
1679,5.0,3056.0,Email Open,01-12-2024 06:03,
1680,2.0,1708.0,email_open,2024-01-08 19:52:00,unknown
1681,8.0,4648.0,email_open,2024-01-04 17:50:00,Browser: Chrome
1682,14.0,4415.0,FORMFILL,2024-01-29 22:18:00,Firefox
1683,12.0,2222.0,form_fill,2024-01-19 13:07:00,Firefox
1684,8.0,4685.0,FORMFILL,2024-01-05 16:10:00,
1685,2.0,4824.0,web-visit,2024-01-29 02:53:00,
1686,10.0,1233.0,email_open,10/01/2024 20:04,unknown
1687,4.0,4667.0,Email Open,2024-01-24 18:10:00,
1688,11.0,3127.0,FORMFILL,01-27-2024 19:07,unknown
1689,5.0,4033.0,Email Open,2024-01-03 08:14:00,tracking lost
1690,6.0,1869.0,email_open,30/01/2024 12:35,
1691,5.0,1758.0,form_fill,2024-01-21 12:34:00,
1692,12.0,4240.0,email_open,01-07-2024 14:20,unknown
1693,5.0,3983.0,email_click,22/01/2024 18:06,tracking lost
1694,10.0,1026.0,,08/01/2024 07:09,unknown
1695,6.0,3904.0,web-visit,2024-01-06 11:40:00,tracking lost
1696,10.0,1740.0,FORMFILL,23/01/2024 19:24,
1697,9.0,3564.0,email_open,08/01/2024 02:10,Browser: Chrome
1698,4.0,3288.0,email_open,2024-01-19 22:37:00,
1699,12.0,1696.0,form_fill,01-25-2024 13:45,Browser: Chrome
1700,3.0,1242.0,web-visit,07/01/2024 08:28,
1701,12.0,4542.0,form_fill,01-10-2024 19:02,
1702,11.0,3061.0,form_fill,01-03-2024 20:58,
1703,9.0,4503.0,email_click,02/01/2024 13:17,tracking lost
1704,3.0,2098.0,email_open,01-19-2024 01:54,
1705,5.0,3523.0,email_open,29/01/2024 12:52,Browser: Chrome
1706,10.0,3204.0,form_fill,07/01/2024 07:35,
1707,14.0,3557.0,Email Open,05/01/2024 03:58,unknown
1708,15.0,2546.0,email_open,01-20-2024 23:06,
1709,7.0,1910.0,email_click,01-23-2024 05:01,unknown
1710,13.0,1428.0,web-visit,01-17-2024 16:51,
1711,10.0,1900.0,,2024-01-28 11:04:00,utm=xyz
1712,11.0,4594.0,,21/01/2024 05:41,
1713,14.0,4801.0,web_visit,01-23-2024 01:04,Browser: Chrome
1714,2.0,1093.0,Email Open,01-25-2024 05:26,
1715,2.0,4187.0,Email Open,2024-01-01 08:28:00,
1716,9.0,1953.0,email_click,01-01-2024 16:08,
1717,2.0,3172.0,web_visit,13/01/2024 23:17,
1718,6.0,4554.0,form_fill,17/01/2024 20:05,Firefox
1719,1.0,1963.0,form_fill,2024-01-26 22:00:00,utm=xyz
1720,8.0,1314.0,web-visit,2024-01-28 01:03:00,
1721,10.0,1949.0,Email Open,2024-01-03 08:54:00,
1722,1.0,2733.0,,12/01/2024 12:11,
1723,15.0,2615.0,Email Open,27/01/2024 12:12,
1724,9.0,1041.0,,01-01-2024 18:38,tracking lost
1725,14.0,2442.0,form_fill,29/01/2024 13:43,tracking lost
1726,4.0,2742.0,FORMFILL,2024-01-15 02:48:00,Browser: Chrome
1727,3.0,2219.0,form_fill,2024-01-15 11:12:00,Firefox
1728,10.0,2157.0,web-visit,28/01/2024 19:45,
1729,2.0,3124.0,EMAIL_CLICK,01-30-2024 02:42,Firefox
1730,4.0,2244.0,,21/01/2024 04:57,
1731,2.0,1471.0,web-visit,13/01/2024 01:39,Firefox
1732,9.0,3754.0,FORMFILL,2024-01-06 17:58:00,
1733,13.0,3269.0,email_click,08/01/2024 21:03,Firefox
1734,1.0,1753.0,Email Open,15/01/2024 22:14,
1735,4.0,3600.0,web_visit,2024-01-25 16:58:00,
1736,9.0,4085.0,Email Open,11/01/2024 21:14,
1737,5.0,4938.0,EMAIL_CLICK,01-23-2024 13:49,
1738,7.0,1649.0,Email Open,27/01/2024 23:16,tracking lost
1739,14.0,1739.0,FORMFILL,01-04-2024 23:30,
1740,2.0,3607.0,form_fill,14/01/2024 03:37,Firefox
1741,6.0,3513.0,Email Open,2024-01-02 19:12:00,
1742,15.0,2432.0,FORMFILL,02/01/2024 03:17,Browser: Chrome
1743,4.0,1642.0,web_visit,01-12-2024 17:06,
1744,3.0,1640.0,email_open,2024-01-16 06:17:00,
1745,3.0,4228.0,,01-08-2024 23:26,utm=xyz
1746,12.0,2275.0,form_fill,2024-01-08 14:57:00,
1747,7.0,1055.0,EMAIL_CLICK,01-18-2024 17:21,
1748,12.0,1090.0,FORMFILL,01-19-2024 11:26,unknown
1749,11.0,2489.0,web-visit,01-28-2024 21:58,
1750,11.0,3793.0,Email Open,25/01/2024 21:14,
1751,13.0,2787.0,email_click,01-20-2024 06:06,
1752,8.0,4372.0,web_visit,01-27-2024 22:55,utm=xyz
1753,3.0,1834.0,email_open,01/01/2024 17:48,
1754,15.0,3823.0,,27/01/2024 20:04,Browser: Chrome
1755,8.0,2182.0,EMAIL_CLICK,01-08-2024 13:37,Firefox
1756,8.0,1900.0,FORMFILL,2024-01-07 21:10:00,unknown
1757,14.0,4464.0,Email Open,2024-01-15 12:58:00,
1758,9.0,2579.0,FORMFILL,01-06-2024 03:05,unknown
1759,12.0,3175.0,email_click,01-07-2024 17:31,utm=xyz
1760,6.0,1120.0,form_fill,2024-01-20 19:02:00,
1761,13.0,4096.0,web-visit,01-18-2024 20:19,utm=xyz
1762,1.0,2572.0,Email Open,30/01/2024 16:38,
1763,12.0,3494.0,Email Open,01-01-2024 09:26,Browser: Chrome
1764,13.0,2583.0,email_click,01-04-2024 11:21,tracking lost
1765,9.0,3505.0,email_open,2024-01-07 01:11:00,
1766,14.0,3715.0,web_visit,12/01/2024 20:10,
1767,3.0,1401.0,email_open,2024-01-16 13:20:00,
1768,11.0,3134.0,email_open,01-11-2024 13:16,Browser: Chrome
1769,10.0,2892.0,email_click,01-25-2024 01:04,
1770,13.0,2495.0,web_visit,01-16-2024 08:52,Browser: Chrome
1771,7.0,3070.0,FORMFILL,26/01/2024 05:04,
1772,8.0,2790.0,form_fill,19/01/2024 15:51,Browser: Chrome
1773,2.0,1750.0,EMAIL_CLICK,01-05-2024 22:36,tracking lost
1774,4.0,2158.0,Email Open,01-04-2024 20:19,
1775,7.0,3256.0,FORMFILL,2024-01-07 16:32:00,Browser: Chrome
1776,12.0,3439.0,FORMFILL,2024-01-18 12:45:00,
1777,15.0,2824.0,email_click,2024-01-21 07:23:00,Firefox
1778,11.0,3980.0,form_fill,2024-01-29 18:10:00,utm=xyz
1779,15.0,3934.0,FORMFILL,2024-01-29 06:23:00,utm=xyz
1780,2.0,3590.0,EMAIL_CLICK,11/01/2024 07:26,tracking lost
1781,5.0,2482.0,web-visit,17/01/2024 04:24,
1782,10.0,1668.0,web_visit,15/01/2024 12:05,Firefox
1783,2.0,2321.0,email_open,2024-01-27 04:59:00,
1784,7.0,1975.0,email_open,01-20-2024 20:06,Firefox
1785,10.0,4833.0,FORMFILL,07/01/2024 21:42,Firefox
1786,12.0,4419.0,email_click,01-16-2024 00:43,
1787,9.0,3851.0,email_open,2024-01-17 21:08:00,
1788,15.0,3358.0,form_fill,2024-01-24 23:17:00,Firefox
1789,10.0,3844.0,web_visit,29/01/2024 00:06,
1790,5.0,3844.0,web_visit,2024-01-26 15:26:00,utm=xyz
1791,15.0,4202.0,email_click,27/01/2024 14:56,
1792,9.0,1342.0,EMAIL_CLICK,20/01/2024 03:23,
1793,12.0,3579.0,email_open,2024-01-11 12:30:00,
1794,13.0,3014.0,web-visit,01-13-2024 23:17,
1795,8.0,2361.0,,01-02-2024 13:07,unknown
1796,12.0,1242.0,web-visit,01-13-2024 14:45,
1797,10.0,4773.0,form_fill,06/01/2024 16:20,utm=xyz
1798,10.0,2986.0,FORMFILL,01-13-2024 10:22,Firefox
1799,12.0,4544.0,EMAIL_CLICK,01-03-2024 04:37,Firefox
1800,3.0,3451.0,web_visit,2024-01-17 01:35:00,Firefox
1801,11.0,1904.0,web-visit,01-02-2024 09:08,unknown
1802,7.0,3939.0,EMAIL_CLICK,01-16-2024 07:29,tracking lost
1803,1.0,4027.0,form_fill,2024-01-28 08:48:00,Browser: Chrome
1804,11.0,3041.0,form_fill,2024-01-19 11:44:00,unknown
1805,11.0,1383.0,web_visit,2024-01-15 23:38:00,
1806,2.0,4990.0,Email Open,2024-01-30 11:37:00,tracking lost
1807,14.0,1779.0,web-visit,26/01/2024 14:51,Firefox
1808,2.0,3780.0,email_open,26/01/2024 06:07,
1809,15.0,1794.0,email_click,09/01/2024 00:36,
1810,2.0,1629.0,EMAIL_CLICK,01-27-2024 20:54,
1811,5.0,4362.0,email_open,02/01/2024 10:05,Firefox
1812,13.0,3672.0,web-visit,10/01/2024 13:07,Browser: Chrome
1813,5.0,4338.0,Email Open,01-01-2024 09:05,
1814,11.0,3476.0,Email Open,2024-01-10 18:00:00,utm=xyz
1815,15.0,3839.0,email_open,2024-01-18 01:55:00,
1816,12.0,1413.0,web-visit,2024-01-18 14:27:00,Firefox
1817,7.0,2541.0,email_click,24/01/2024 12:48,tracking lost
1818,10.0,1313.0,web_visit,01-27-2024 08:41,
1819,8.0,3358.0,EMAIL_CLICK,2024-01-21 10:46:00,tracking lost
1820,10.0,3261.0,,01-21-2024 15:36,utm=xyz
1821,14.0,3197.0,Email Open,01-13-2024 13:52,
1822,12.0,3538.0,email_open,14/01/2024 09:29,Browser: Chrome
1823,2.0,2690.0,web_visit,2024-01-25 10:24:00,Firefox
1824,1.0,2528.0,,2024-01-15 11:50:00,Firefox
1825,6.0,4987.0,FORMFILL,25/01/2024 23:52,Firefox
1826,5.0,1949.0,email_click,02/01/2024 07:55,unknown
1827,13.0,4563.0,email_click,01-17-2024 17:12,
1828,9.0,2817.0,form_fill,2024-01-29 04:35:00,Firefox
1829,8.0,4281.0,email_click,07/01/2024 21:46,
1830,9.0,4456.0,form_fill,29/01/2024 11:04,Firefox
1831,8.0,2755.0,email_click,01-09-2024 03:33,utm=xyz
1832,2.0,1861.0,form_fill,2024-01-09 14:42:00,
1833,11.0,3056.0,form_fill,26/01/2024 05:07,
1834,2.0,3194.0,email_open,24/01/2024 23:36,
1835,10.0,3889.0,web_visit,01-18-2024 17:14,unknown
1836,7.0,3171.0,email_open,2024-01-02 18:28:00,
1837,11.0,4593.0,email_click,14/01/2024 09:25,Browser: Chrome
1838,10.0,4151.0,EMAIL_CLICK,01-23-2024 00:26,
1839,3.0,3101.0,email_open,2024-01-25 08:54:00,
1840,10.0,3551.0,web_visit,2024-01-29 16:41:00,Browser: Chrome
1841,13.0,1694.0,web-visit,01-07-2024 23:00,
1842,10.0,3006.0,web-visit,01-19-2024 14:25,utm=xyz
1843,14.0,1092.0,web-visit,01-21-2024 21:20,unknown
1844,9.0,1988.0,,17/01/2024 08:26,unknown
1845,1.0,1527.0,FORMFILL,01-03-2024 20:02,
1846,5.0,2837.0,web_visit,20/01/2024 23:13,Firefox
1847,1.0,1415.0,email_click,20/01/2024 09:31,tracking lost
1848,8.0,2180.0,Email Open,2024-01-20 11:38:00,Firefox
1849,13.0,2471.0,,01-02-2024 12:41,unknown
1850,8.0,4256.0,form_fill,01-24-2024 16:17,utm=xyz
1851,9.0,2545.0,EMAIL_CLICK,01-18-2024 22:11,
1852,3.0,2332.0,FORMFILL,2024-01-03 08:40:00,tracking lost
1853,12.0,1431.0,email_open,01-06-2024 10:00,
1854,14.0,4130.0,email_open,21/01/2024 00:42,
1855,6.0,2068.0,web_visit,01-30-2024 15:35,
1856,8.0,1293.0,Email Open,2024-01-08 20:50:00,
1857,15.0,3869.0,Email Open,01-21-2024 23:49,
1858,2.0,4994.0,web-visit,01-16-2024 05:23,
1859,10.0,4887.0,web-visit,01-02-2024 10:40,unknown
1860,10.0,3588.0,email_click,01-01-2024 21:48,
1861,14.0,2288.0,web_visit,01-25-2024 18:34,Browser: Chrome
1862,14.0,4141.0,FORMFILL,01-02-2024 18:42,Firefox
1863,1.0,1591.0,,01-30-2024 16:43,
1864,8.0,1588.0,Email Open,01-03-2024 13:04,
1865,8.0,2901.0,EMAIL_CLICK,2024-01-14 07:48:00,tracking lost
1866,6.0,4150.0,email_open,01-10-2024 06:25,utm=xyz
1867,13.0,2770.0,EMAIL_CLICK,01-09-2024 22:51,Firefox
1868,10.0,3903.0,form_fill,01-28-2024 21:31,
1869,14.0,1257.0,EMAIL_CLICK,09/01/2024 11:53,
1870,1.0,3323.0,FORMFILL,01-24-2024 11:47,tracking lost
1871,15.0,4616.0,,01-01-2024 16:17,Firefox
1872,6.0,3271.0,Email Open,2024-01-28 09:47:00,
1873,15.0,2528.0,email_open,2024-01-03 12:21:00,
1874,15.0,3744.0,Email Open,26/01/2024 19:02,utm=xyz
1875,5.0,3656.0,email_open,2024-01-23 11:26:00,
1876,14.0,3363.0,email_click,01-30-2024 04:20,
1877,13.0,4106.0,email_open,28/01/2024 19:07,tracking lost
1878,1.0,1500.0,Email Open,2024-01-17 00:04:00,
1879,15.0,4069.0,FORMFILL,01-29-2024 03:23,Browser: Chrome
1880,13.0,3608.0,web_visit,2024-01-24 01:21:00,tracking lost
1881,14.0,1685.0,Email Open,2024-01-28 21:22:00,tracking lost
1882,9.0,2592.0,email_open,25/01/2024 17:18,
1883,4.0,1274.0,form_fill,2024-01-04 17:12:00,Firefox
1884,12.0,4361.0,,06/01/2024 22:50,Browser: Chrome
1885,7.0,2539.0,email_click,01-23-2024 23:27,
1886,5.0,1620.0,FORMFILL,01/01/2024 01:26,Firefox
1887,1.0,1471.0,web-visit,24/01/2024 16:02,Firefox
1888,8.0,1072.0,Email Open,2024-01-20 08:14:00,
1889,4.0,4961.0,Email Open,10/01/2024 21:37,unknown
1890,12.0,3070.0,web_visit,18/01/2024 09:40,
1891,7.0,3708.0,Email Open,2024-01-22 21:15:00,unknown
1892,12.0,1247.0,web_visit,27/01/2024 14:03,Browser: Chrome
1893,14.0,4062.0,EMAIL_CLICK,24/01/2024 06:24,Firefox
1894,8.0,2021.0,web_visit,2024-01-26 13:20:00,
1895,15.0,4759.0,email_open,01-18-2024 07:51,
1896,15.0,1186.0,,01-20-2024 01:46,utm=xyz
1897,5.0,4780.0,form_fill,01-14-2024 07:17,
1898,8.0,3872.0,email_click,2024-01-17 19:44:00,Browser: Chrome
1899,1.0,4087.0,Email Open,2024-01-25 14:47:00,tracking lost
1900,2.0,3367.0,Email Open,22/01/2024 18:51,
1901,11.0,3411.0,EMAIL_CLICK,2024-01-07 02:14:00,tracking lost
1902,10.0,3299.0,,01-03-2024 13:38,
1903,7.0,3128.0,web_visit,01-06-2024 19:15,
1904,5.0,4852.0,EMAIL_CLICK,26/01/2024 21:37,tracking lost
1905,9.0,2068.0,form_fill,01-28-2024 14:08,
1906,11.0,4812.0,web-visit,18/01/2024 08:36,Browser: Chrome
1907,15.0,2385.0,web_visit,29/01/2024 06:21,
1908,6.0,3204.0,FORMFILL,01-24-2024 22:38,unknown
1909,9.0,3578.0,,2024-01-01 02:00:00,unknown
1910,8.0,4773.0,email_open,2024-01-21 22:01:00,Firefox
1911,2.0,4815.0,form_fill,14/01/2024 07:49,tracking lost
1912,13.0,2662.0,EMAIL_CLICK,01-30-2024 05:50,
1913,2.0,3179.0,email_click,2024-01-05 21:10:00,unknown
1914,8.0,4945.0,email_click,2024-01-11 09:56:00,
1915,10.0,1733.0,,13/01/2024 08:25,Browser: Chrome
1916,5.0,1098.0,email_click,01-26-2024 21:26,Firefox
1917,15.0,4133.0,FORMFILL,01-12-2024 00:14,Browser: Chrome
1918,11.0,2911.0,web_visit,01-17-2024 01:16,
1919,7.0,2093.0,EMAIL_CLICK,01-14-2024 12:17,unknown
1920,2.0,2226.0,email_open,01-09-2024 11:27,unknown
1921,5.0,1270.0,email_click,06/01/2024 07:43,
1922,6.0,4329.0,email_click,18/01/2024 23:35,Browser: Chrome
1923,1.0,4846.0,email_open,11/01/2024 03:59,utm=xyz
1924,10.0,1603.0,,21/01/2024 18:39,
1925,10.0,2383.0,email_open,04/01/2024 20:53,utm=xyz
1926,8.0,2309.0,email_click,01-27-2024 12:05,
1927,12.0,4335.0,web-visit,01/01/2024 20:16,Firefox
1928,3.0,2852.0,email_open,10/01/2024 08:31,
1929,14.0,3469.0,email_open,2024-01-30 05:52:00,
1930,9.0,2576.0,web-visit,01-12-2024 03:03,
1931,9.0,2112.0,Email Open,01-08-2024 14:05,
1932,8.0,1883.0,email_click,2024-01-15 23:57:00,
1933,11.0,1375.0,Email Open,2024-01-07 18:21:00,
1934,14.0,2102.0,EMAIL_CLICK,14/01/2024 09:53,
1935,2.0,1272.0,Email Open,2024-01-01 01:43:00,utm=xyz
1936,7.0,1296.0,FORMFILL,01-13-2024 01:37,Browser: Chrome
1937,7.0,1895.0,FORMFILL,28/01/2024 02:16,
1938,13.0,1621.0,email_click,2024-01-20 23:16:00,unknown
1939,6.0,2587.0,Email Open,2024-01-06 19:45:00,
1940,9.0,1110.0,web-visit,2024-01-26 22:03:00,unknown
1941,1.0,1233.0,web_visit,2024-01-15 02:21:00,
1942,7.0,3245.0,web-visit,14/01/2024 15:45,
1943,7.0,2021.0,email_click,2024-01-25 01:44:00,
1944,5.0,2348.0,web_visit,2024-01-09 02:33:00,
1945,2.0,2475.0,EMAIL_CLICK,01-12-2024 21:45,
1946,15.0,2478.0,Email Open,2024-01-19 11:21:00,
1947,4.0,1630.0,,18/01/2024 00:31,Browser: Chrome
1948,14.0,4809.0,web_visit,2024-01-25 19:00:00,
1949,5.0,2800.0,FORMFILL,01-26-2024 16:18,utm=xyz
1950,8.0,4871.0,form_fill,02/01/2024 16:27,utm=xyz
1951,7.0,3587.0,,01-15-2024 23:08,
1952,12.0,1141.0,,20/01/2024 02:24,
1953,3.0,1739.0,email_click,01-17-2024 16:04,
1954,14.0,2905.0,,01-25-2024 19:57,Browser: Chrome
1955,5.0,2369.0,Email Open,21/01/2024 18:34,
1956,8.0,3833.0,email_click,2024-01-27 10:57:00,Firefox
1957,4.0,4790.0,Email Open,01-04-2024 14:57,utm=xyz
1958,5.0,1511.0,FORMFILL,15/01/2024 07:52,
1959,12.0,3865.0,email_open,15/01/2024 01:55,
1960,1.0,3533.0,email_click,01-24-2024 17:32,utm=xyz
1961,15.0,4716.0,Email Open,01-21-2024 21:33,unknown
1962,10.0,2268.0,email_open,08/01/2024 05:29,tracking lost
